web_url,headline,pub_date
https://www.nytimes.com/2018/03/28/arts/music/american-songbook-lincoln-center.html,What Makes a Songbook American? Justin Vivian Bond and Rosanne Cash Have a Few Answers,2018-03-29T00:49:23+0000,"Music, American Songbook (Music Series), Pop and Rock Music, Carpenters, The (Music Group), Lincoln Center for the Performing Arts, Carpenter, Karen, Bond, Justin Vivian, Cash, Rosanne, Frankel, Scott, Korie, Michael"
https://artsbeat.blogs.nytimes.com/2015/03/12/the-americans-recap-never-break-the-chain/,‘The Americans’ Recap: Never Break the Chain,2015-03-12T16:59:51+0000,"Television, Emmerich, Noah, Fleetwood Mac"
https://india.blogs.nytimes.com/2013/04/25/on-being-brown-in-america/,On Being Brown in America,2013-04-25T13:24:27+0000,"Boston Marathon Bombings (2013), Indian-Americans, Race and Ethnicity, Boston (Mass), United States"
https://www.nytimes.com/2020/06/03/arts/george-floyd-video-racism.html,The Videos That Rocked America. The Song That Knows Our Rage.,2020-06-03T17:53:10+0000,"George Floyd Protests (2020), Black People, Blacks, Police Brutality, Misconduct and Shootings, Coronavirus (2019-nCoV), Police Department (Minneapolis, Minn), Floyd, George (d 2020), Music, LaBelle, Patti, If You Don't Know Me by Now (Song), Video Recordings, Downloads and Streaming"
https://www.nytimes.com/2023/08/16/opinion/health-care-life-expectancy-poverty.html,How Do We Fix the Scandal That Is American Health Care?,2023-08-16T23:00:24+0000,"United States, Medicine and Health, Health Insurance and Managed Care, Preventive Medicine, Medicaid, Hospitals, Diabetes, AMPUTATION, Mississippi, Poverty, Income Inequality, Diet and Nutrition, Obesity, Smoking and Tobacco, Native Americans, Black People, Blacks, Hispanic-Americans"
https://www.nytimes.com/2021/07/11/style/pyer-moss-couture.html,A Black American Designer Disrupts the French Couture,2021-07-11T19:20:57+0000,"Jean-Raymond, Kerby, Pyer Moss Apparel Group LLC, Fashion and Apparel, Black People, Blacks, Couture (Fashion), your-feed-fashion"
https://www.nytimes.com/2020/11/07/opinion/sunday/gay-nigeria-black-america.html,"Gay in Nigeria, Black Male in America",2020-11-07T16:00:08+0000,"Black Lives Matter Movement, Black People, Blacks, Race and Ethnicity, Discrimination, Torture, Hate Crimes, Men and Boys, United States"
https://www.nytimes.com/video/opinion/100000001579773/transition.html,Transition,2012-05-31T21:11:48+0000,"Hair, Blacks, Black People"
https://www.nytimes.com/2015/02/27/books/review-the-sellout-paul-beattys-biting-satire-on-black-american-culture.html,"Review: ‘The Sellout,’ Paul Beatty’s Biting Satire on Race in America",2015-02-26T18:47:31+0000,"Books and Literature, Beatty, Paul, The Sellout (Book)"
https://www.nytimes.com/slideshow/2010/06/16/fashion/20100617-gimlet.html,Clipper Master,2010-06-17T01:38:58+0000,"Hair, Barbers and Barbering, HARLEM (NYC), Design, Blacks, Black People, Nineteen Hundred Eighties"
https://www.nytimes.com/2014/06/04/world/middleeast/american-jailed-in-egypt-appeals-to-obama-for-help.html,American Jailed in Egypt Appeals to Obama for Help,2014-06-03T21:08:57+0000,"Egypt, Middle East and North Africa Unrest (2010- ), Political Prisoners, Rabaa al-Adawiya (Cario, Egypt), Hunger Strikes, Obama, Barack"
https://www.nytimes.com/2022/08/02/arts/television/nichelle-nichols-uhura-star-trek.html,Nichelle Nichols Helped Show America a Different Future,2022-08-02T15:34:50+0000,"Content Type: Personal Profile, Black People, Blacks, Television, Space and Astronomy, Science Fiction, Nichols, Nichelle, Star Trek (TV Program), Actors and Actresses"
https://www.nytimes.com/2017/06/13/us/politics/bernie-sanders-progressives-presidential-election-2020.html,"Is Bernie Sanders, 75, Too Old for 2020? His Fiercest Fans Say No",2017-06-13T09:00:28+0000,"Sanders, Bernard, United States Politics and Government, Presidential Election of 2020, Democratic Party, Politics and Government, Warren, Elizabeth"
https://www.nytimes.com/2014/06/29/nyregion/a-review-of-along-his-own-lines-a-retrospective-of-new-york-realist-eugene-speicher-in-new-paltz.html,American Realism by Way of Woodstock,2014-06-27T22:36:25+0000,"Speicher, Eugene, Dorsky, Samuel, Museum of Art, New Paltz (NY), Art"
https://www.nytimes.com/2022/07/23/us/politics/beagles-airport-security.html,Meet the Canine Officers Guarding American Agriculture,2022-07-23T16:32:26+0000,"Service Dogs and Other Animals, Smell (Olfaction), Dulles International Airport (Washington, DC), AGRICULTURE DEPARTMENT, Dogs, Customs and Border Protection (US), Luggage and Packing, Smells and Odors, Airports, United States Politics and Government"
https://www.nytimes.com/2010/03/28/books/excerpt-appetite-for-america.html,‘Appetite for America’,2010-03-26T18:33:08+0000,Books and Literature
https://www.nytimes.com/2014/07/02/us/census-bureau-arabs-hispanics-diversity.html,Census Considers How to Measure a More Diverse America,2014-07-01T19:27:57+0000,"Race and Ethnicity, Vega, Tanzina, Census, Hispanic-Americans, ARAB-AMERICANS"
https://www.nytimes.com/2018/08/24/arts/television/america-to-me-review.html,Review: ‘America to Me’ Is a Searing Lesson in School Inequity,2018-08-24T14:30:01+0000,"Television, James, Steve (1954- ), Starz, Documentary Films and Programs, Oak Park and River Forest High School (Oak Park, Ill), Education (K-12), Blacks, Black People, Race and Ethnicity, Discrimination"
https://www.nytimes.com/2015/10/25/travel/durban-south-africa-restaurants.html,"In Durban, South Africa, 13 Curry Stops in 5 Days",2015-10-23T11:00:09+0000,"Travel and Vacations, Khan, Sarah, Durban (South Africa), Food, Cooking and Cookbooks, South Africa"
https://www.nytimes.com/2018/05/24/arts/design/venice-architecture-biennale.html,Creators of Architectural Exhibits Reach To the Cosmos for Inspiration,2018-05-24T09:00:08+0000,"Venice Architecture Biennale, Studio Gang Architects, Diller Scofidio & Renfro, University of Chicago, Gang, Jeanne, Venice (Italy)"
https://www.nytimes.com/2016/10/30/opinion/sunday/3-tvs-and-no-food-growing-up-poor-in-america.html,3 TVs and No Food: Growing Up Poor in America,2016-10-28T11:55:06+0000,"Kristof, Nicholas D, Poverty, Presidential Election of 2016, United States, Children and Childhood"
https://www.nytimes.com/2023/05/13/us/chief-standing-bear-stamp-usps.html,Native American Chief Standing Bear Is Honored on Postal Stamp,2023-05-13T14:04:35+0000,"Chief Standing Bear, Native Americans, Civil Rights and Liberties, Stamps (Postal), Nebraska, Postal Service (US), Suits and Litigation (Civil)"
https://www.nytimes.com/2013/01/27/magazine/could-cyril-ramaphosa-be-the-best-leader-south-africa-has-not-yet-had.html,Could Cyril Ramaphosa Be the Best Leader South Africa Has Not Yet Had?,2013-01-23T12:00:51+0000,"Ramaphosa, Cyril, South Africa, AFRICAN NATIONAL CONGRESS, Mines and Mining, Marikana (South Africa), Politics and Government"
https://www.nytimes.com/2017/02/22/opinion/a-place-for-water-aerobics-and-feeling-safe-as-american-jews.html,A Place for Water Aerobics and Feeling Safe as American Jews,2017-02-22T21:46:39+0000,"Anti-Semitism, Jewish Community Center Assn of North America, Trump, Donald J, United States Politics and Government"
https://www.nytimes.com/2017/06/06/magazine/americas-hidden-hiv-epidemic.html,America’s Hidden H.I.V. Epidemic,2017-06-06T09:00:36+0000,"Discrimination, Acquired Immune Deficiency Syndrome, Jackson (Miss), Blacks, Black People, Homosexuality and Bisexuality, Epidemics, Sexually Transmitted Diseases"
https://www.nytimes.com/2015/07/15/books/review-oreo-fran-ross.html,"Review: ‘Oreo,’ a Sandwich-Cookie of a Feminist Comic Novel",2015-07-14T09:00:23+0000,"Books and Literature, Ross, Fran (1935-85), Oreo (Book)"
https://www.nytimes.com/interactive/2020/05/26/magazine/coronavirus-milwaukee-unemployment-jobs.html,Can America’s Middle Class Be Saved from a New Depression?,2020-05-27T03:23:57+0000,"Coronavirus (2019-nCoV), Labor and Jobs, Wisconsin, Black People, Blacks, United States Economy, Unemployment"
https://www.nytimes.com/2019/04/25/us/ilhan-omar-muslim-reactions.html,Unchecked ‘Hate’ Toward Rep. Ilhan Omar Has American Muslims Shuddering,2019-04-25T09:00:11+0000,"Omar, Ilhan, Muslim Americans, Blacks, Black People, Muslims and Islam, Discrimination, Race and Ethnicity, United States Politics and Government, Pelosi, Nancy, Trump, Donald J"
https://takingnote.blogs.nytimes.com/2014/05/01/eurocentric-beauty-ideals-in-the-military/,Eurocentric Beauty Ideals in the Military,2014-05-01T19:44:37+0000,"Beauty (Concept), Blacks, Black People, Hair, Hagel, Chuck"
https://www.nytimes.com/2014/03/06/fashion/zoe-kravitz-on-her-beauty-regimen.html,"Dutiful, Beautiful, Morning and Night",2014-03-06T00:04:38+0000,"Kravitz, Zoe, Beauty, Cosmetics and Toiletries, Skin"
https://www.nytimes.com/2015/06/07/books/review/loving-day-by-mat-johnson.html,"‘Loving Day,’ by Mat Johnson",2015-06-01T09:30:07+0000,"Books and Literature, Dreisinger, Baz, Johnson, Mat (1970- ), Loving Day (Book)"
https://www.nytimes.com/2023/07/06/world/africa/zambia-conservation-delia-owens.html,Americans Tried to Save Elephants in Zambia. Were They the Good Guys?,2023-07-06T13:45:54+0000,"Zambia, Wildlife Trade and Poaching, Conservation of Resources, Elephants, Owens, Delia, North Luangwa National Park (Zambia), internal-open-access-from-nl, internal-sub-only"
https://www.nytimes.com/2021/08/13/opinion/us-dirty-work.html,America Runs on ‘Dirty Work’ and Moral Inequality,2021-08-13T15:00:07+0000,"Labor and Jobs, Ethics (Personal), Workplace Hazards and Violations, Income Inequality, Mental Health and Disorders, Abuse of the Disabled, Prisons and Prisoners, Prison Guards and Corrections Officers, Factory Farming"
https://www.nytimes.com/2014/08/12/books/jess-rows-your-face-in-mine-explores-racial-reassignment.html,"In a Novelist’s World, You Choose Your Race",2014-08-11T16:36:22+0000,"Books and Literature, Row, Jess (1974- ), Race and Ethnicity, Writing and Writers, Your Face in Mine (Book)"
https://www.nytimes.com/2017/03/10/world/middleeast/reporting-from-syria-an-american-with-a-point-of-view-and-a-message.html,"Reporting From Syria, an American With a Point of View and a Message",2017-03-10T14:30:15+0000,"Syria, Abdul Kareem, Bilal, News and News Media, Al Nusra Front, AL QAEDA"
https://opinionator.blogs.nytimes.com/2014/06/23/american-indians-in-confederate-territory/,American Indians in Confederate Territory,2014-06-23T18:18:16+0000,"Civil War (US) (1861-65), Native Americans, Prisoners of War, Army of Northern Virginia, Army of the Potomac, Virginia"
https://opinionator.blogs.nytimes.com/2015/12/24/dear-white-america/,Dear White America,2015-12-24T08:40:25+0000,"Blacks, Black People, Discrimination, Philosophy, Race and Ethnicity"
https://www.nytimes.com/2022/12/23/arts/music/comic-opera-company-united-states.html,America Needs Its Own Comic Opera Company,2022-12-23T10:00:20+0000,"Opera, Comedy and Humor, Weill, Kurt, Davis, Anthony (1951- ), Bolcom, William, United States"
https://www.nytimes.com/2021/06/22/books/review-songbooks-literature-of-popular-music-eric-weisbard.html,Touring American Pop Music by Way of the Writers Who Have Addressed It,2021-06-22T17:26:03+0000,"Books and Literature, Writing and Writers, Music, Weisbard, Eric, Songbooks: The Literature of American Popular Music (Book), United States"
https://www.nytimes.com/2011/01/30/us/30mixed.html,Black? White? Asian? More Young Americans Choose All of the Above,2011-01-30T03:28:13+0000,"Native Americans, Hispanic-Americans, United States, Blacks, Black People, Population, Children and Youth, Race and Ethnicity, Asian-Americans, Genealogy, Census"
https://www.nytimes.com/2018/02/23/style/black-women-hair-beauty.html,"At the ‘Hairdresser’s Fashion Week,’ Celebrating Black Beauty",2018-02-23T13:15:06+0000,"Hair, Blacks, Black People, Atlanta (Ga), Conventions, Fairs and Trade Shows"
https://www.nytimes.com/2015/03/01/magazine/building-the-first-slave-museum-in-america.html,Building the First Slavery Museum in America,2015-02-26T09:58:10+0000,"Amsden, David, Whitney Plantation (Wallace, La), Louisiana, Cummings, John (1937- ), Blacks, Black People, Slavery (Historical), Museums"
https://www.nytimes.com/2017/11/14/business/barbie-hijab-ibtihaj-muhammad.html,New Barbie Is Modeled After American Olympian Who Wears a Hijab,2017-11-14T22:11:18+0000,"Barbie (Doll), Muslim Veiling, Muslims and Islam, Council on American-Islamic Relations, Glamour (Magazine), Mattel Inc, Muhammad, Ibtihaj"
https://www.nytimes.com/2022/07/06/style/willie-lee-morrow-dead.html,"Willie Lee Morrow, Barber Who Popularized the Afro Pick, Dies at 82",2022-07-06T21:19:36+0000,"Morrow, Willie Lee (1939-2022), Deaths (Obituaries), Hair, Black People, Blacks, Civil Rights Movement (1954-68), Barbers and Barbering"
https://www.nytimes.com/2016/04/19/world/africa/vehicle-in-convoy-of-samantha-power-kills-boy-in-cameroon.html,Vehicle in Convoy of U.S. Ambassador to U.N. Kills Boy in Cameroon,2016-04-19T01:41:20+0000,"Cameroon, Power, Samantha, Traffic Accidents and Safety, Boko Haram, United States International Relations, United Nations, State Department"
https://www.nytimes.com/2016/03/27/magazine/shuffle-along-and-the-painful-history-of-black-performance-in-america.html,‘Shuffle Along’ and the Lost History of Black Performance in America,2016-03-24T10:50:05+0000,"Theater, Blacks, Black People, Shuffle Along (Play)"
https://www.nytimes.com/2013/11/26/health/families.html,The Changing American Family,2013-11-26T04:57:44+0000,"Families and Family Life, Sociology, United States"
https://www.nytimes.com/2011/02/05/sports/soccer/05holden.html,American Makes Best of Second Chance in England,2011-02-05T01:22:37+0000,"English Premier League, Holden, Stuart, Bolton Wanderers (Soccer Team), Soccer"
https://www.nytimes.com/2011/02/04/sports/soccer/04holden.html,American Makes Best of Second Chance in Premier League,2011-02-03T16:55:24+0000,"English Premier League, Holden, Stuart, Bolton Wanderers (Soccer Team)"
https://www.nytimes.com/2021/10/05/magazine/asian-american-identity.html,The Myth of Asian American Identity,2021-10-05T09:00:18+0000,"Race and Ethnicity, Asian-Americans, Kang, Jay Caspian, United States, Content Type: Personal Profile"
https://www.nytimes.com/2018/02/04/business/bell-pottinger-guptas-zuma-south-africa.html,"How Bell Pottinger, P.R. Firm for Despots and Rogues, Met Its End in South Africa",2018-02-05T04:00:35+0000,"South Africa, Bell Pottinger Group, Public Relations and Publicity, Gupta Family, Oakbay Investments, Zuma, Jacob G, Bell, Timothy (1941- ), Henderson, James Brodie, Race and Ethnicity, Income Inequality, Social Media, Blacks, Black People, vis-photo"
https://www.nytimes.com/2015/09/25/arts/design/new-books-analyze-the-photographs-of-frederick-douglass-and-sojourner-truth.html,New Books Analyze the Photographs of Frederick Douglass and Sojourner Truth,2015-09-24T21:50:04+0000,"Books and Literature, Truth, Sojourner, Douglass, Frederick, Stauffer, John, Trodd, Zoe, Bernier, Celeste-Marie, Antiques, Photography, Enduring Truths: Sojourner's Shadows and Substance (Book), Picturing Frederick Douglass: An Illustrated Biography of the Nineteenth Century's Most Photographed American (Book)"
https://www.nytimes.com/2016/02/15/world/africa/malawi-gets-its-first-grammy-nomination-with-album-by-prison-inmates.html,"Malawi Gets Its First Grammy Nomination, With Album by Prison Inmates",2016-02-15T02:09:52+0000,"Music, Malawi, Grammy Awards, Prisons and Prisoners, Brennan, Ian, Binamo, Thomas"
https://www.nytimes.com/2021/02/18/learning/what-students-are-saying-about-race-and-racism-in-america.html,What Students Are Saying About Race and Racism in America,2021-02-18T20:48:06+0000,
https://www.nytimes.com/2016/10/21/arts/design/kerry-james-marshalls-paintings-show-what-it-means-to-be-black-in-america.html,Kerry James Marshall’s Paintings Show What It Means to Be Black in America,2016-10-20T22:28:28+0000,"Art, Met Breuer, Blacks, Black People, Marshall, Kerry James, Civil Rights Movement (1954-68)"
https://www.nytimes.com/2020/02/01/us/DeAndre-Arnold-dreadlocks.html,Student Suspended Over Dreadlocks Is Invited to the Oscars,2020-02-01T19:53:54+0000,"Arnold, DeAndre, Hair, Black People, Blacks, Discrimination, Academy Awards (Oscars), Movies, Hair Love (Movie), Wade, Dwyane (1982- ), Union, Gabrielle, Education (K-12), Texas"
https://runway.blogs.nytimes.com/2012/06/25/how-natural-is-too-natural/,How Natural is Too Natural?,2012-06-25T20:35:48+0000,"Blacks, Black People, Hair"
https://www.nytimes.com/interactive/2018/01/15/us/1968-history.html,"50 Years Later, It Feels Familiar: How America Fractured in 1968",2018-01-15T14:48:59+0000,"Demonstrations, Protests and Riots, Vietnam War, Blacks, Black People, Presidential Election of 1968, Nineteen Hundred Sixties, Police Brutality, Misconduct and Shootings, Civil Rights Movement (1954-68), King, Martin Luther Jr, Kennedy, Robert Francis, Nixon, Richard Milhous"
https://www.nytimes.com/interactive/2019/12/23/magazine/elijah-cummings-death.html,"Elijah Cummings’s American Dream, and American Obstacles",2019-12-23T19:56:21+0000,"Deaths (Obituaries), Baltimore (Md), Black People, Blacks, Senate"
https://www.nytimes.com/interactive/2020/10/19/t-magazine/angela-davis.html,Angela Davis Still Believes America Can Change,2020-10-19T09:08:04+0000,"Davis, Angela Y, Content Type: Personal Profile, Black People, Blacks, Black Lives Matter Movement, Race and Ethnicity, Women and Girls, Discrimination, Transgender and Transsexuals, Demonstrations, Protests and Riots"
https://www.nytimes.com/2018/04/10/magazine/tracy-k-smith-believes-america-needs-a-poetry-cure.html,"Tracy K. Smith, America’s Poet Laureate, Is a Woman With a Mission",2018-04-10T09:00:03+0000,"Poetry and Poets, Blacks, Black People, Writing and Writers, Poets Laureate, Life on Mars (Book), Young, Kevin (1970- )"
https://www.nytimes.com/2022/10/27/world/europe/uk-schools-afro-hair.html,U.K. Tells Schools They Can’t Ban Afro Hairstyles,2022-10-27T16:27:39+0000,"Discrimination, Black People, Blacks, Hair, Human Rights and Human Rights Violations, Education, Equality and Human Rights Commission (Great Britain), London (England), Great Britain"
https://www.nytimes.com/interactive/2023/06/23/realestate/barbie-dreamhouse.html,"Barbie, Her House and the American Dream",2023-06-23T09:00:02+0000,"Barbie (Doll), Women and Girls, Dollhouses, Design, vis-design"
https://www.nytimes.com/2020/09/16/opinion/biden-trump-2020-violence.html,Whose America Is It?,2020-09-16T09:00:22+0000,"Presidential Election of 2020, Antifa Movement (US), Demonstrations, Protests and Riots, George Floyd Protests (2020), United States Politics and Government, Right-Wing Extremism and Alt-Right, Coronavirus (2019-nCoV), Democratic Party, Republican Party, Trump, Donald J, Biden, Joseph R Jr, Absentee Voting, Voter Fraud (Election Fraud)"
https://www.nytimes.com/interactive/2018/05/31/theater/best-25-plays.html,The Great Work Continues: The 25 Best American Plays Since ‘Angels in America’,2018-05-31T19:33:14+0000,
https://www.nytimes.com/2020/04/29/magazine/racial-disparities-covid-19.html,‘A Terrible Price’: The Deadly Racial Disparities of Covid-19 in America,2020-04-29T09:00:14+0000,"Zulu Social Aid and Pleasure Club, Black People, Blacks, Race and Ethnicity, Coronavirus (2019-nCoV), Mardi Gras, New Orleans (La), Louisiana, Deaths (Fatalities), United States"
https://www.nytimes.com/2017/06/14/learning/did-delta-air-lines-and-bank-of-america-do-the-right-thing-when-they-pulled-their-funding-of-julius-caesar.html,Did Delta Air Lines and Bank of America Do the Right Thing When They Pulled Their Funding of ‘Julius Caesar’?,2017-06-14T09:00:08+0000,"Reading and Writing Skills (Education), News and News Media, New York Times, Freedom of Speech and Expression"
https://www.nytimes.com/2021/03/02/magazine/why-i-started-wearing-head-wraps.html,Why I Started Wearing Head Wraps,2021-03-02T10:00:07+0000,"Black People, Blacks, Hair, Fashion and Apparel"
https://www.nytimes.com/interactive/2020/06/19/arts/black-photographers-self-portraits.html,Self-Portraits From Black Photographers Reflecting on America,2020-06-19T09:00:02+0000,"George Floyd Protests (2020), Black Lives Matter Movement, Black People, Blacks, Photography, Fortune, Rahim, Scruggs, Dana (Photographer), Carter, Erik (Photographer), Weems, Carrie Mae, Barnes, Miranda (Photographer), Carter, Kennedi (Photographer), Edeani, Ike, Palmer, Brian (Photographer), Ortiz, Carlos Javier (Photographer), Valentine, Gioncarlo, Barboza, Anthony, Diallo, Delphine, Wagner, Andre D, Ogbonna, Brad, Deeman, Erica, Johnson, Nitashia, Pettway, Jessica, Agins, Michelle V, Scales, Jeffrey Henson, Murff, Zora J, Higgins, Chester Jr, Willis, Deborah (1982- ), Franco, Angel (1951- ), Malone, Yasmine (Photographer), Isaiah, Texas (Photographer), Muhammad, Ozier (1950- ), Wilson, Jim (Photographer), United States"
https://www.nytimes.com/2017/10/31/obituaries/fred-beckey-dead-mountain-climber.html,"Fred Beckey, Conqueror of North American Peaks, Dies at 94",2017-10-31T04:31:38+0000,"Beckey, Fred (1923-2017), Mountaineering, Deaths (Obituaries)"
https://www.nytimes.com/interactive/2019/10/28/style/tradition-in-america.html,What Makes a Tradition American?,2019-10-28T21:30:47+0000,"Presidential Election of 2020, Refugees and Displaced Persons, Immigration and Emigration, Cooking and Cookbooks"
https://www.nytimes.com/2018/10/18/briefing/the-week-in-good-news-this-is-18-sea-turtles.html,"The Week in Good News: #ThisIs18, America in 24 Hours, Sea Turtles",2018-10-18T15:12:08+0000,
https://www.nytimes.com/2019/08/03/us/hairstyles-black-students-appropriate-inappropriate.html,Georgia Elementary School Is Accused of Racial Insensitivity Over Hairstyle Guidelines Display,2019-08-03T09:00:07+0000,"Education (K-12), Discrimination, Blacks, Black People, Hair, Race and Ethnicity, Politics and Government, Decatur (Ga), DeKalb County (Ga)"
https://www.nytimes.com/2019/02/24/us/black-inventors.html,Seven Black Inventors Whose Patents Helped Shape American Life,2019-02-24T10:00:10+0000,"Inventions and Patents, Blacks, Black People, Patent and Trademark Office (US), Morgan, Garrett A, Brown, Marie Van Brittan, JOHNSON, LONNIE G, Kenner, Mary Beatrice, Drew, Charles R (1904-50), Bath, Patricia, Weatherby, Dennis"
https://www.nytimes.com/2020/04/13/science/putin-russia-disinformation-health-coronavirus.html,Putin’s Long War Against American Science,2020-04-13T11:30:05+0000,"United States International Relations, Putin, Vladimir V, Coronavirus (2019-nCoV), Rumors and Misinformation, United States Defense and Military Forces, Epidemics, Computers and the Internet, Social Media, Vaccination and Immunization, News and News Media, Biological and Chemical Warfare, Espionage and Intelligence Services, Influenza, Blogs and Blogging (Internet), Medicine and Health, Fringe Groups and Movements, Biotechnology and Bioengineering, your-feed-science, your-feed-health, Centers for Disease Control and Prevention, RT (TV Network), RT America (TV Network)"
https://www.nytimes.com/article/pictures-george-floyd-protests-photos.html,In Photos: Protesters March in Cities Across America,2020-06-01T10:04:11+0000,"Police Brutality, Misconduct and Shootings, Demonstrations, Protests and Riots, Minneapolis (Minn), Photography, George Floyd Protests (2020), Black People, Blacks, Race and Ethnicity, Murders, Attempted Murders and Homicides, Washington (DC), Floyd, George (d 2020), Taylor, Breonna (1993-2020)"
https://www.nytimes.com/2017/04/21/books/review/american-poets-refusing-to-go-gentle-rage-against-the-right.html,"American Poets, Refusing to Go Gentle, Rage Against the Right",2017-04-21T23:27:36+0000,"Poetry and Poets, United States Politics and Government, Poetry Society of America, Presidential Election of 2016"
https://www.nytimes.com/2021/01/19/books/review/craft-an-american-history-by-glenn-adamson-an-excerpt.html,"‘Craft: An American History,’ by Glenn Adamson: An Excerpt",2021-01-19T20:13:26+0000,
https://www.nytimes.com/2015/11/01/magazine/edna-lewis-and-the-black-roots-of-american-cooking.html,Edna Lewis and the Black Roots of American Cooking,2015-10-28T11:00:05+0000,"Lewis, Edna (1916-2006), Cooking and Cookbooks, Blacks, Black People, Southern States (US), Books and Literature, Agriculture and Farming, Food, The Taste of Country Cooking (Book)"
https://www.nytimes.com/2021/03/01/t-magazine/latoya-ruby-frazier-photography.html,"LaToya Ruby Frazier, American Witness",2021-03-01T13:00:13+0000,"Black People, Blacks, Families and Family Life, Content Type: Personal Profile, Photography, Race and Ethnicity, Labor and Jobs, Frazier, LaToya Ruby, Braddock (Pa)"
https://www.nytimes.com/interactive/2022/03/28/magazine/quinta-brunson-interview.html,Quinta Brunson Knows Why America Was Ready for ‘Abbott Elementary’,2022-03-28T09:00:02+0000,"Brunson, Quinta, Abbott Elementary (TV Program), Content Type: Personal Profile, Black People, Blacks, Education (K-12), Television, Homosexuality and Bisexuality"
https://www.nytimes.com/2020/03/16/magazine/bernie-sanders-campaign.html,Did America Misjudge Bernie Sanders? Or Did He Misjudge America?,2020-03-16T09:00:08+0000,"Sanders, Bernard, Presidential Election of 2020, Democratic Party, Biden, Joseph R Jr, Socialism (Theory and Philosophy), Vermont, United States Politics and Government"
https://www.nytimes.com/2012/05/12/sports/carroll-shelby-builder-of-cobra-sports-car-dies-at-89.html,"Carroll Shelby, Car Builder Who Added Muscle to American Racing, Dies at 89",2012-05-11T21:08:34+0000,"Deaths (Obituaries), Shelby, Carroll, Automobiles"
