web_url,headline,pub_date
https://www.nytimes.com/2021/03/11/nyregion/birth-centers-new-jersey.html,Why Black Women Are Rejecting Hospitals in Search of Better Births,2021-03-11T10:00:26+0000
https://www.nytimes.com/2019/07/02/books/kids-books-barbershops-laundromats.html,Want Kids to Learn the Joy of Reading? Barbershops and Laundromats Can Help,2019-07-02T09:00:13+0000
https://www.nytimes.com/2018/05/15/movies/spike-lee-blackkklansman-trump.html,Spike Lee Turns a Period Piece Into a Protest of the Trump Era,2018-05-15T20:45:51+0000
https://www.nytimes.com/2018/08/18/arts/music/aretha-franklin-black-women.html,Aretha Franklin Was the Personification of Black Woman Magic,2018-08-18T09:00:11+0000
https://www.nytimes.com/2023/09/24/opinion/social-justice-parenting.html,The Moral Theater of Social Justice Parenting,2023-09-24T10:00:11+0000
https://www.nytimes.com/2011/01/17/arts/music/17ongala.html,"Remmy Ongala, Tanzanian Musical Star, Dies at 63",2011-01-17T04:17:35+0000
https://www.nytimes.com/2020/12/22/movies/soul-pixar-disney-black-characters.html,‘Soul’ Features Pixar’s First Black Lead Character. Here’s How It Happened.,2020-12-22T20:15:17+0000
https://www.nytimes.com/2019/10/27/opinion/trump-benedict-college.html,Trump’s Black College Spectacle,2019-10-28T00:30:28+0000
https://www.nytimes.com/2022/03/07/dining/hogs-southern-food-tradition.html,"One Huge Hog, One Long Day and a Nourishing Southern Tradition",2022-03-07T21:10:09+0000
https://www.nytimes.com/2017/02/20/crosswords/ambitious-high-school-student.html,Ambitious High School Student,2017-02-21T03:00:02+0000
https://www.nytimes.com/2015/01/31/opinion/how-bad-data-fed-the-ebola-epidemic.html,How Bad Data Fed the Ebola Epidemic,2015-01-30T11:18:06+0000
https://www.nytimes.com/2020/08/14/world/africa/mauritius-oil-spill.html,‘This Is Unforgivable’: Anger Mounts Over Mauritius Oil Spill,2020-08-14T12:00:09+0000
https://www.nytimes.com/2017/05/30/theater/on-strivers-row-review.html,"Review: ‘On Strivers Row,’ Where Snobbery Knows No Boundaries",2017-05-30T20:38:07+0000
https://www.nytimes.com/2020/03/24/business/coronavirus-per-country-pandemic.html,"In World’s Most Vulnerable Countries, the Pandemic Rivals the 2008 Crisis",2020-03-24T13:51:03+0000
https://www.nytimes.com/2020/03/06/theater/skinfolk-review.html,"Review: In ‘Skinfolk,’ the Joys of Blackness Burst From the Earth",2020-03-06T23:33:35+0000
https://www.nytimes.com/2010/10/10/nyregion/10artsli.html,Applying Broad Strokes to a Time of War,2010-10-08T22:49:23+0000
https://www.nytimes.com/2016/05/22/arts/television/roots-remade-for-a-new-era.html,"‘Roots,’ Remade for a New Era",2016-05-18T09:00:22+0000
https://www.nytimes.com/2016/09/15/briefing/donald-trump-hillary-clinton-edward-snowden.html,"Donald Trump, Hillary Clinton, Edward Snowden: Your Thursday Evening Briefing",2016-09-15T21:58:12+0000
https://www.nytimes.com/interactive/2019/12/09/magazine/lupita-nyongo-us.html,Why Is Hollywood Afraid of Lupita Nyong’o?,2019-12-09T23:59:17+0000
https://www.nytimes.com/interactive/2020/05/26/magazine/coronavirus-nj-unemployment-jobs.html,"For Families Already Stretched to the Limit, the Pandemic Is a Disaster",2020-05-26T09:00:05+0000
https://www.nytimes.com/2012/06/15/arts/design/slow-fade-to-black-at-celebrate-brooklyn-in-prospect-park.html,Two Artists Salute a Legacy,2012-06-14T21:52:26+0000
https://www.nytimes.com/2021/12/30/arts/design/doris-lee-overlooked-artist-exhibition.html,"Doris Lee, Unjustly Forgotten, Gets a Belated but Full Blown Tribute",2021-12-30T15:00:16+0000
https://www.nytimes.com/2014/09/08/arts/music/robert-plant-releases-lullaby-and-the-ceaseless-roar.html,Ascending Without Zeppelin,2014-09-07T21:41:46+0000
https://www.nytimes.com/2017/06/20/opinion/philando-castile-and-the-terror-of-an-ordinary-day.html,Philando Castile and the Terror of an Ordinary Day,2017-06-20T07:21:07+0000
https://tmagazine.blogs.nytimes.com/2014/09/17/deborah-kass-craig-martin-outdoor-art-mall-chestnut-hill-florida/,Artists Take Over Two Outdoor Malls in Massachusetts and Florida,2014-09-17T21:15:49+0000
https://www.nytimes.com/2010/07/30/arts/design/30antiques.html,Edna St. Vincent Millay’s Home; the Apollo; Irons Galore,2010-07-29T20:02:59+0000
https://www.nytimes.com/2018/11/12/us/affirmative-action-asian-americans.html,‘It’s Like Reliving My Past’: Harvard Lawsuit Echoes Previous Fight Over Race and Admissions,2018-11-12T10:00:09+0000
https://www.nytimes.com/2020/12/10/movies/small-axe-review-steve-mcqueen.html,‘Small Axe’ Review: The Agonies and Ecstasies of Black British Lives,2020-12-10T16:32:33+0000
https://www.nytimes.com/2018/11/12/us/affirmative-action-asian-americans.html,‘It’s Like Reliving My Past’: Harvard Lawsuit Echoes Previous Fight Over Race and Admissions,2018-11-12T10:00:09+0000
https://www.nytimes.com/politics/first-draft/2015/05/27/hillary-clinton-calls-for-civil-campaign-south-carolina/,"In South Carolina, Hillary Clinton Calls for a Civil Campaign",2015-05-27T21:21:13+0000
https://www.nytimes.com/2020/06/16/dining/fat-rice-chicago-abe-conlon-racism.html,A Top Chicago Restaurant Messaged Its Virtue. Then Workers Spoke Up.,2020-06-16T09:00:26+0000
https://www.nytimes.com/2010/07/30/arts/design/30antiques.html,Edna St. Vincent Millay’s Home; the Apollo; Irons Galore,2010-07-29T20:02:59+0000
https://atwar.blogs.nytimes.com/2014/07/14/the-enemy-through-the-eyes-of-a-child/,"‘The Enemy,’ Through the Eyes of a Child",2014-07-14T14:51:19+0000
https://www.nytimes.com/2023/08/16/opinion/florida-prager-slavery-frederick-douglass.html,"Using Frederick Douglass to Rationalize Slavery? In Florida, Yes!",2023-08-16T23:50:14+0000
https://www.nytimes.com/2023/06/30/business/economy/hiring-affirmative-action.html,"Affirmative Action Ruling May Upend Hiring Policies, Too",2023-06-30T21:36:35+0000
https://opinionator.blogs.nytimes.com/2010/11/22/lincoln-speaks/,Lincoln Speaks,2010-11-23T00:30:56+0000
https://www.nytimes.com/2021/08/06/briefing/jobs-vaccines-team-mascots.html,"Jobs, Vaccines, Team Mascots: Your Friday Evening Briefing",2021-08-06T21:40:55+0000
https://www.nytimes.com/2013/06/03/booming/revisiting-the-tawana-brawley-rape-scandal.html,Revisiting a Rape Scandal That Would Have Been Monstrous if True,2013-06-03T10:35:52+0000
https://www.nytimes.com/2019/04/16/us/politics/biden-hollings-funeral.html,"Biden, at Hollings Funeral, Talks About How ‘People Can Change’",2019-04-16T18:05:18+0000
https://www.nytimes.com/2018/06/22/books/review/christine-schutt-pure-hollywood.html,Short Stories That Travel the World From a Deliciously Off-Kilter Perspective,2018-06-22T09:00:01+0000
https://www.nytimes.com/2020/03/11/arts/visualizing-refugee-experience.html,Visualizing the Refugee Experience,2020-03-11T13:43:42+0000
https://www.nytimes.com/2011/02/18/arts/music/18paradis.html,"A Soft Pop Chanteuse, Striking Delicate Poses",2011-02-17T23:01:58+0000
https://www.nytimes.com/2018/12/05/obituaries/charles-harrison-dead.html,"Charles Harrison, 87, Designer Who Reshaped the View-Master, Dies",2018-12-05T20:56:40+0000
https://www.nytimes.com/2021/08/09/arts/jay-z-black-album.html,Jay-Z’s ‘Black Album’ Helped Me Beat the Odds. Will We Finally Even Them?,2021-08-09T09:00:21+0000
https://www.nytimes.com/2019/02/20/reader-center/black-mathematicians-research-academic-racism.html,What I Learned While Reporting on the Dearth of Black Mathematicians,2019-02-20T10:00:09+0000
https://www.nytimes.com/2011/03/26/opinion/26iht-edbutcher26.html,In the Footsteps of Graham Greene,2011-03-25T12:03:13+0000
https://www.nytimes.com/2010/10/24/books/review/Kamp-t.html,Pirate Latitudes,2010-10-22T16:57:11+0000
https://www.nytimes.com/2016/01/07/fashion/an-artist-stands-before-her-fun-house-mirror.html,An Artist Stands Before Her Fun House Mirror,2016-01-06T10:02:09+0000
https://www.nytimes.com/2018/06/21/arts/design/oprah-winfrey-smithsonian-national-museum-of-african-american-history-and-culture.html,Oprah Earned This Museum Show. And It’s a Potent Spectacle.,2018-06-21T18:41:23+0000
https://www.nytimes.com/2021/02/23/arts/design/union-mural-king-adjaye.html,The Union Moved. The Beloved Mosaic Mural Couldn’t.,2021-02-23T18:38:01+0000
https://www.nytimes.com/2012/01/31/science/these-mammals-pack-a-toxic-punch.html,"Warm and Furry, but They Pack a Toxic Punch",2012-01-30T19:03:22+0000
https://www.nytimes.com/2014/02/27/books/susan-minots-thirty-girls-and-more.html,Newly Released Books,2014-02-26T21:15:55+0000
https://www.nytimes.com/2010/03/05/us/05cnccorners.html,A Place Where Open and Honest Discussions Are in Style,2010-03-05T03:54:30+0000
https://www.nytimes.com/2017/02/23/books/the-pleasures-of-a-writer-who-was-richard-pryor-on-paper.html,The Pleasures of a Writer Who Was ‘Richard Pryor on Paper’,2017-02-23T22:41:54+0000
https://well.blogs.nytimes.com/2016/07/25/meet-the-super-flasher-some-menopausal-women-suffer-years-of-hot-flashes/,Meet the Super Flasher: Some Menopausal Women Suffer Years of Hot Flashes,2016-07-25T17:08:27+0000
https://www.nytimes.com/2021/04/30/opinion/john-mcwhorter-n-word-unsayable.html,How the N-Word Became Unsayable,2021-04-30T11:57:55+0000
https://www.nytimes.com/2019/06/08/opinion/diversity-hollywood-black.html,The Black Characters I Wish I Saw More Of,2019-06-08T19:20:25+0000
https://www.nytimes.com/2016/03/13/nyregion/documenting-violence-against-women-even-if-its-hard-to-look.html,"Documenting Violence Against Women, Even if It’s Hard to Look",2016-03-11T01:46:56+0000
https://www.nytimes.com/2017/02/24/travel/pittsburgh-pennsylvania-underground-railroad-slavery.html,"Pittsburgh’s Underground Railroad, Preserved and Not",2017-02-24T19:39:41+0000
https://opinionator.blogs.nytimes.com/2016/01/05/the-cultural-contours-of-saving-a-life/,The Cultural Contours of Saving a Life,2016-01-05T11:45:56+0000
https://www.nytimes.com/2018/02/01/opinion/langston-hughes-birthday.html,Remember Langston Hughes’s Anger Alongside His Joy,2018-02-01T10:45:14+0000
https://www.nytimes.com/2018/05/29/opinion/memorial-day-paul-bucha-speech.html,A Hero’s Plea on Memorial Day,2018-05-29T18:45:04+0000
https://www.nytimes.com/2021/11/11/t-magazine/senegal-homegrown-rice.html,"In Senegal, a Return to Homegrown Rice",2021-11-11T10:00:24+0000
https://www.nytimes.com/2015/06/10/opinion/who-gets-to-go-to-the-pool.html,Who Gets to Go to the Pool?,2015-06-10T07:21:08+0000
https://www.nytimes.com/2014/09/24/technology/24shave.html,"Where Profit Margins Are Hefty, Online Upstarts Muscle In ",2014-09-24T01:03:18+0000
https://www.nytimes.com/2022/01/14/books/review/just-pursuit-laura-coates-the-rage-of-innocence-kristin-henning.html,Two High-Powered Black Attorneys Confront a Justice System’s Flaws,2022-01-14T10:00:05+0000
https://www.nytimes.com/2020/07/17/us/bloomington-indiana-vauhxx-booker.html,"2 White Men Charged After Helping Pin Black Man to a Tree in Indiana, Officials Say",2020-07-17T19:47:04+0000
https://www.nytimes.com/2023/10/29/briefing/israel-hamas-war-ukraine-us-seoul-halloween.html,Monday Briefing: Israel Extends Gaza Ground Campaign,2023-10-29T20:34:03+0000
https://www.nytimes.com/2022/09/10/us/dragon-con-diversity.html,Redefining What Nerd Culture Looks Like,2022-09-10T11:53:06+0000
https://www.nytimes.com/2014/12/04/opinion/global-agenda-2015.html,Global Agenda 2015,2014-12-04T08:18:40+0000
https://www.nytimes.com/2023/09/08/t-magazine/carrie-mae-weems-george-c-wolfe.html,Carrie Mae Weems and George C. Wolfe on Defiance and Claiming Space,2023-09-08T09:01:01+0000
https://www.nytimes.com/2021/07/14/obituaries/bernette-ford-dead.html,"Bernette Ford, Who Made Children’s Books More Diverse, Dies at 70",2021-07-14T19:06:30+0000
https://www.nytimes.com/2021/02/11/world/canada/calgary-firefighters-racism.html,‘I’m Speaking Out:’ Calgary Firefighters Allege Decades of Racism,2021-02-11T15:33:46+0000
https://www.nytimes.com/2016/06/10/nyregion/in-lawsuit-us-says-queens-school-discriminated-against-3-black-teachers.html,"In Lawsuit, U.S. Says Queens School Discriminated Against 3 Black Teachers",2016-06-09T16:37:55+0000
https://www.nytimes.com/2021/01/03/us/oregon-cares-fund-lawsuit.html,A Covid-19 Relief Fund Was Only for Black Residents. Then Came the Lawsuits.,2021-01-03T10:00:14+0000
https://www.nytimes.com/2021/06/23/us/politics/democrats-voter-id-laws.html,Why Democrats Are Reluctantly Making Voter ID Laws a Bargaining Chip,2021-06-23T22:23:47+0000
https://www.nytimes.com/2014/03/20/fashion/makeup-foundation-for-the-many-shades-of-women.html,Makeup That Addresses the Many Shades of Women,2014-03-19T21:51:01+0000
https://www.nytimes.com/2018/03/22/opinion/joshunda-sanders-black-austin-bombing.html,What It’s Like to Be Black in Austin,2018-03-22T15:10:54+0000
https://www.nytimes.com/2023/09/08/t-magazine/carrie-mae-weems-george-c-wolfe.html,Carrie Mae Weems and George C. Wolfe on Defiance and Claiming Space,2023-09-08T09:01:01+0000
https://www.nytimes.com/2019/06/28/sports/for-cleon-jones-baseball-was-only-the-beginning.html,"For Cleon Jones, Baseball Was Only the Beginning",2019-06-28T11:00:05+0000
https://www.nytimes.com/2019/07/12/us/busing-reader-voices.html,"Self-Segregation, School Pride, Classism: Sharing Your Memories of Busing",2019-07-13T00:09:50+0000
https://www.nytimes.com/2022/09/20/style/jasmine-guillory-romance-novel.html,A Lawyer Finds Her Happily-Ever-After as a Romance Writer,2022-09-20T19:52:08+0000
https://www.nytimes.com/2021/10/22/nyregion/hijab-muslim-nj-student.html,Online Furor Over a Student’s Hijab Engulfs a Liberal Town,2021-10-22T07:00:12+0000
https://www.nytimes.com/2021/09/02/arts/design/midwest-museum-road-trip.html,Finding a Globe’s Worth of Art Treasures Close to Home,2021-09-02T17:48:12+0000
https://www.nytimes.com/interactive/2022/06/17/arts/black-family-heirlooms-juneteenth.html,See the Family Heirlooms That Carry History,2022-06-17T20:18:39+0000
https://goal.blogs.nytimes.com/2010/07/27/maradona-and-grondona-in-showdown-over-argentinas-future/,Maradona Loses Showdown With Grondona Over Argentina’s Future,2010-07-27T17:21:46+0000
https://www.nytimes.com/2015/07/07/books/the-secret-of-william-carlos-williamss-the-red-wheelbarrow.html,The Forgotten Man Behind William Carlos Williams’s ‘Red Wheelbarrow’,2015-07-06T21:37:00+0000
https://www.nytimes.com/2020/04/12/arts/design/deborah-roberts-artist-virus-austin.html,"A Dream Deferred, for Now",2020-04-12T14:00:09+0000
https://www.nytimes.com/2012/07/21/nyregion/in-beacon-an-arty-evening-stroll.html,"Once a Month, a City’s Art and Music Spill Out After Dark",2012-07-21T00:20:24+0000
https://www.nytimes.com/2018/12/18/technology/russian-interference-instagram.html,"Russian Trolls Came for Instagram, Too",2018-12-18T10:00:13+0000
https://www.nytimes.com/2022/11/19/sports/gymnastics-fisk-hbcu.html,The First H.B.C.U. Gymnastics Team Is Aiming Even Higher,2022-11-19T14:00:15+0000
https://www.nytimes.com/2022/07/20/opinion/duke-ellington.html,Duke Ellington Deserves the 1965 Pulitzer Prize,2022-07-20T17:20:40+0000
https://lens.blogs.nytimes.com/2014/01/22/black-performers-fading-from-frame-and-memory/,"Black Performers, Fading From Frame, and Memory",2014-01-22T10:00:32+0000
https://www.nytimes.com/2012/10/20/health/puberty-starting-earlier-in-boys-new-study-suggests.html,"Boys Now Enter Puberty Younger, Study Suggests, but It’s Unclear Why",2012-10-20T04:01:48+0000
https://www.nytimes.com/2019/09/14/travel/black-cowboy-museum-texas.html,Restoring Black Cowboys to the Range,2019-09-14T09:00:13+0000
https://www.nytimes.com/2023/01/17/books/review/american-inheritance-edward-larson.html,Can the Country Come to Terms With Its Original Sin?,2023-01-17T10:00:16+0000
https://tmagazine.blogs.nytimes.com/2011/08/26/chic-in-review-alec-baldwins-ohm-sweet-ohm/,Chic in Review | Alec Baldwin’s Om Sweet Om,2011-08-26T21:30:28+0000
https://latitude.blogs.nytimes.com/2012/03/09/kony-2012-is-a-distraction-from-issues-ordinary-ugandans-care-about/,The Kony Kerfuffle,2012-03-09T15:35:55+0000
https://www.nytimes.com/2020/05/21/us/coronavirus-nursing-homes-racial-disparity.html,The Striking Racial Divide in How Covid-19 Has Hit Nursing Homes,2020-05-21T09:00:22+0000
https://www.nytimes.com/2018/02/12/arts/obama-portraitists-bonded-the-everyday-and-the-extraordinary.html,Obama Portrait Artists Merged the Everyday and the Extraordinary,2018-02-12T22:55:49+0000
https://www.nytimes.com/2022/10/06/t-magazine/quinta-brunson-abbott-elementary.html,How Quinta Brunson Gets Her Skin Ready for ‘Abbott Elementary’,2022-10-06T13:00:05+0000
https://www.nytimes.com/2018/04/16/briefing/james-comey-barbara-bush-coachella.html,"James Comey, Barbara Bush, Coachella: Your Monday Briefing",2018-04-16T09:39:00+0000
https://www.nytimes.com/2020/06/24/well/family/how-to-raise-an-anti-racist-kid.html,How to Raise an Anti-Racist Kid,2020-06-24T09:00:16+0000
https://www.nytimes.com/2010/02/15/arts/design/15broken.html,"A Poignant Trail of Broken Hearts, All on Display",2010-02-14T23:18:52+0000
https://www.nytimes.com/2012/10/26/arts/design/now-dig-this-art-black-los-angeles-at-moma-ps1.html,Forged From the Fires of the 1960s,2012-10-25T22:21:47+0000
https://www.nytimes.com/2013/02/08/arts/design/blues-for-smoke-at-the-whitney-museum.html,Mood Indigo: A Playlist for the Mind,2013-02-07T22:35:05+0000
https://www.nytimes.com/2022/10/26/books/review/new-this-week.html,"Newly Published, From Flamingo Feathers to North Korea",2022-10-26T15:01:56+0000
https://www.nytimes.com/2021/08/23/theater/broadway-diversity-pledge-reopening.html,Broadway Power Brokers Pledge Diversity Changes as Theaters Reopen,2021-08-23T18:00:10+0000
https://www.nytimes.com/2023/06/17/style/david-austin-roses-danny-clarke.html,Prestigious Rose Breeder Names Its New Bloom for a Black Gardener,2023-06-17T14:32:24+0000
https://www.nytimes.com/2019/01/24/arts/design/john-dunkley-american-folk-art-museum.html,"John Dunkley, an Outsider Artist Deep in the Heart of Jamaica",2019-01-24T19:51:09+0000
https://www.nytimes.com/2021/08/29/sports/pittsburgh-pirates-anniversary.html,"A Lineup of Color Made History, Even if It Felt ‘Routine’",2021-08-29T13:00:09+0000
https://www.nytimes.com/2022/02/03/arts/things-to-do-this-weekend.html,5 Things to Do This Weekend,2022-02-03T10:00:20+0000
https://www.nytimes.com/2018/07/24/books/review/new-noteworthy-celia-dugger.html,New & Noteworthy,2018-07-24T09:00:05+0000
https://www.nytimes.com/2020/11/08/fashion/kamala-harris-speech-suffrage.html,"Kamala Harris in a White Suit, Dressing for History",2020-11-08T17:59:44+0000
https://www.nytimes.com/2016/12/07/us/dylann-roof-trial.html,Heart-Rending Testimony as Dylann Roof Trial Opens,2016-12-07T15:57:16+0000
https://www.nytimes.com/2020/04/10/business/minority-business-coronavirus-loans.html,Black-Owned Businesses Could Face Hurdles in Federal Aid Program,2020-04-10T20:35:52+0000
https://www.nytimes.com/2018/04/17/t-magazine/muses-1980s-patti-hansen-farida-khelfa.html,When Models Became as Famous as the Artists they Inspired,2018-04-17T12:54:29+0000
https://www.nytimes.com/2010/12/05/magazine/05sudan-t.html,Attention-Grabber for Sudan’s Cause,2010-12-02T16:57:13+0000
https://www.nytimes.com/2020/05/07/arts/design/john-singer-sargent-drawings-gardner-museum.html,John Singer Sargent’s Drawings Bring His Model Out of the Shadows,2020-05-07T17:10:42+0000
https://www.nytimes.com/2017/02/09/arts/television/elizabeth-warren-letter-daily-show.html,"Elizabeth Warren Slams the G.O.P. on ‘The Daily Show,’ and Colbert Pounces, Too",2017-02-09T09:59:37+0000
https://www.nytimes.com/2022/12/09/arts/television/trevor-noah-final-daily-show.html,Trevor Noah Tearfully Signs Off from ‘The Daily Show’,2022-12-09T08:01:49+0000
https://tmagazine.blogs.nytimes.com/2012/08/10/chic-in-review-eyebrow-transplants/,Chic in Review | Eyebrow Transplants?,2012-08-10T22:00:27+0000
https://lens.blogs.nytimes.com/2014/11/28/when-glamour-speaks-your-name/,When Glamour Speaks Your Name,2014-11-28T10:00:29+0000
https://www.nytimes.com/2021/10/17/us/politics/black-staff-congress.html,"As Some Black Staff Members Leave Congress, Those Who Remain Call for Change",2021-10-17T15:59:35+0000
https://www.nytimes.com/2016/10/24/us/turn-onto-old-dixie-after-a-long-rocky-stretch-it-becomes-obama-highway.html,"Turn Onto Old Dixie. After a Long, Rocky Stretch, It Becomes Obama Highway.",2016-10-24T00:28:58+0000
https://www.nytimes.com/2017/04/05/business/kendall-jenner-pepsi-ad.html,Pepsi Pulls Ad Accused of Trivializing Black Lives Matter,2017-04-05T15:30:01+0000
https://www.nytimes.com/2018/08/07/briefing/alex-jones-california-karunanidhi.html,"Alex Jones, California, Karunanidhi: Your Wednesday Briefing",2018-08-07T20:14:50+0000
https://www.nytimes.com/2016/02/26/fashion/prada-peta-hermes-fendi.html,PETA Revives Luxury Fight,2016-02-25T18:12:27+0000
https://www.nytimes.com/2010/03/21/movies/homevideo/21KEHR.html,"Riding the Rapids With Hepburn, Bogart and Huston",2010-03-19T18:05:06+0000
https://www.nytimes.com/2012/11/01/theater/reviews/lonette-mckee-in-sowas-red-gravy-at-the-castillo.html,Otherworldly People With Earthy Tastes,2012-10-31T20:13:37+0000
https://www.nytimes.com/2011/11/14/sports/a-lifetime-of-battling-bias.html,A Lifetime of Battling Bias,2011-11-14T01:26:58+0000
https://thelede.blogs.nytimes.com/2011/11/21/videos-capture-violent-scenes-in-egypt/,Videos Capture Violent Scenes in Egypt,2011-11-21T17:43:34+0000
https://www.nytimes.com/2011/05/27/arts/design/edward-lycett-designer-for-faience-company-brooklyn.html,"Edward Lycett, Designer for Faience Company, Brooklyn",2011-05-26T22:02:19+0000
https://www.nytimes.com/2015/07/10/books/review-in-between-the-world-and-me-ta-nehisi-coates-delivers-a-desperate-dispatch-to-his-son.html,"Review: In ‘Between the World and Me,’ Ta-Nehisi Coates Delivers a Searing Dispatch to His Son",2015-07-09T19:36:50+0000
https://www.nytimes.com/2012/10/28/realestate/streetscapes-on-st-nicholas-avenue-houses-built-with-the-ladies-in-mind.html,Built With the Ladies In Mind,2012-10-26T01:36:55+0000
https://www.nytimes.com/2016/12/31/opinion/sunday/what-does-it-mean-to-acknowledge-the-past.html,What Does It Mean to Acknowledge the Past?,2016-12-31T19:30:03+0000
https://www.nytimes.com/2012/05/02/us/hamtramck-high-holds-all-girl-prom.html,"This Prom Has Everything, Except for Boys",2012-05-01T16:10:31+0000
https://www.nytimes.com/2016/09/12/opinion/about-the-basket-of-deplorables.html,About the ‘Basket of Deplorables’,2016-09-12T07:21:05+0000
https://www.nytimes.com/2011/05/27/arts/design/edward-lycett-designer-for-faience-company-brooklyn.html,"Edward Lycett, Designer for Faience Company, Brooklyn",2011-05-26T22:02:19+0000
https://www.nytimes.com/2017/07/27/podcasts/reveling-in-the-unapologetic-blackness-of-girls-trip.html,Reveling in the Unapologetic Blackness of ‘Girls Trip’,2017-07-27T10:00:04+0000
https://www.nytimes.com/2018/11/04/business/media/nigerian-fashion-magazines-women.html,"As Nigerian Fashion Booms, Women Lead Its Coverage",2018-11-04T17:47:46+0000
https://www.nytimes.com/2020/06/19/nyregion/nyc-juneteenth-celebrations.html,How to Celebrate Juneteenth in N.Y.C.,2020-06-19T07:46:28+0000
https://www.nytimes.com/2015/12/25/arts/design/william-edmondsons-boxer-presumed-lost-goes-to-auction.html,"William Edmondson’s ‘Boxer,’ Presumed Lost, Goes to Auction",2015-12-24T20:28:49+0000
https://www.nytimes.com/2013/06/14/movies/20-feet-from-stardom-explores-world-of-backup-singers.html,Turning Up the Voices From the Background,2013-06-13T23:57:43+0000
https://www.nytimes.com/2021/12/13/well/live/uterine-fibroids-black-women.html,‘I Felt Like No One Truly Listened’: The Invisible Toll of Fibroids on Black Women,2021-12-13T17:42:36+0000
https://www.nytimes.com/2018/06/14/lens/miss-black-and-beautiful-beauty-pageants.html,These 1970s Pageants Celebrated Black Women's Beauty,2018-06-14T08:00:01+0000
https://www.nytimes.com/2012/04/01/opinion/sunday/prom-night.html,Prom Night,2012-03-30T20:36:34+0000
https://www.nytimes.com/2010/05/26/us/politics/26bai.html,2010’s Debates Still Trapped in the 1960s,2010-05-26T01:10:44+0000
https://www.nytimes.com/2018/05/23/opinion/graduate-student-cancer-research.html,Finding Myself in Research,2018-05-23T18:47:20+0000
https://www.nytimes.com/2021/11/11/us/ahmaud-arbery-videos-trial.html,"In Trial of Men Accused of Arbery Murder, Jurors Consider Security Videos",2021-11-11T23:58:14+0000
https://kristof.blogs.nytimes.com/2010/06/01/malaria-a-students-firsthand-account/,Malaria: A Student’s Firsthand Account,2010-06-01T18:02:05+0000
https://www.nytimes.com/2018/03/03/us/when-hollywood-is-our-mirror.html,When Hollywood Is Our Mirror,2018-03-03T15:42:08+0000
https://www.nytimes.com/2017/04/26/theater/bandstand-review-broadway.html,Review: Singing and Dancing the Postwar Blues in ‘Bandstand’,2017-04-27T02:00:35+0000
https://www.nytimes.com/2023/01/10/us/jaylen-smith-mayor-earle-arkansas.html,An Ailing Arkansas City Elected an 18-Year-Old Mayor to Turn Things Around,2023-01-10T20:19:13+0000
https://www.nytimes.com/2017/11/13/arts/design/richard-avedon-nothing-personal-pace-macgill.html,Why Richard Avedon’s Work Has Never Been More Relevant,2017-11-13T17:35:36+0000
https://www.nytimes.com/2019/11/15/smarter-living/how-to-move-abroad.html,How to Move Abroad,2019-11-15T21:57:55+0000
https://www.nytimes.com/2016/09/14/briefing/donald-trump-syria-iphone.html,"Donald Trump, Syria, iPhone: Your Wednesday Briefing",2016-09-14T09:45:57+0000
https://www.nytimes.com/2018/04/20/books/review/david-reich-who-we-are-how-we-got-here.html,A Brand-New Version of Our Origin Story,2018-04-20T09:00:13+0000
