web_url,headline,pub_date
https://www.nytimes.com/2023/12/05/us/darryl-george-hair-locs-texas.html,Black Student in Texas Is Suspended Over Hair Length Again,2023-12-06T03:06:50+0000
https://www.nytimes.com/2023/11/16/arts/design/for-jonathan-lyndon-chase-artists-space.html,"For Jonathan Lyndon Chase, Hair Is Rooted in Pride",2023-11-16T05:56:23+0000
https://www.nytimes.com/2023/11/13/theater/jajas-african-hair-braiding-black-women.html,When a Seat in the Theater Means a Seat in the Salon,2023-11-13T15:34:27+0000
https://www.nytimes.com/2023/10/27/world/europe/france-inclusive-hair-salons.html,A Scientist’s Salons in Paris Cater to a Neglected Trait: Curly Hair,2023-10-27T09:03:57+0000
https://www.nytimes.com/2023/10/12/us/darryl-george-texas-hair-expelled.html,Black Student Suspended Over Hair Length Is Sent to Disciplinary School,2023-10-12T14:21:42+0000
https://www.nytimes.com/2023/10/06/opinion/race-natural-hair-heritage.html,My Hair Was Always a Source of Tension Between My Mother and Me. Then We Met Charlotte.,2023-10-06T09:01:24+0000
https://www.nytimes.com/2023/09/24/us/darryl-george-texas-lawsuit-crown-act.html,Black High School Student Suspended Over His Hair Length Sues Texas Leaders,2023-09-24T18:31:15+0000
https://www.nytimes.com/2023/09/22/arts/television/matthew-a-cherry-young-love-max.html,"With ‘Young Love,’ Matthew A. Cherry Weaves a Warm Chicago Tale",2023-09-22T16:23:52+0000
https://www.nytimes.com/2023/09/14/us/texas-student-locs-hair-crown-act.html,"In Texas, a Black High School Student Is Suspended Over His Hair Length",2023-09-14T20:36:41+0000
https://www.nytimes.com/2023/09/15/theater/jocelyn-bioh-jajas-african-hair-braiding.html,When the Wig Is a Character: Backstage at Jocelyn Bioh’s New Play,2023-09-15T09:00:46+0000
https://www.nytimes.com/2023/07/17/style/curlfest-nyc.html,Celebrating Their Roots at Curlfest,2023-07-17T22:19:21+0000
https://www.nytimes.com/2023/06/21/business/unilever-black-women-hair-products.html,This Salon Works to Understand Black Women’s Hair,2023-06-21T09:00:35+0000
https://www.nytimes.com/interactive/2023/06/22/t-magazine/art/kim-dacres-art-exhibit.html,"On View: Bantu Knots and Braids, Sculpted From Recycled Tires",2023-06-22T16:10:53+0000
https://www.nytimes.com/2016/10/06/opinion/white-schools-vs-black-hair-in-post-apartheid-south-africa.html,White Schools vs. Black Hair in Post-Apartheid South Africa,2016-10-05T12:57:47+0000
https://www.nytimes.com/2014/09/09/nyregion/black-women-find-a-growing-business-opportunity-care-for-their-hair.html,Black Women Find a Growing Business Opportunity: Care for Their Hair,2014-09-08T14:59:13+0000
https://www.nytimes.com/2017/07/13/style/meechy-monroe-dead-natural-hair-movement.html,"Meechy Monroe, a YouTube Star for Her Natural Hair Lessons, Dies at 32",2017-07-13T22:30:26+0000
https://www.nytimes.com/2019/02/21/nyregion/black-hair-decriminalization-ny.html,The Decriminalization of Black Hair,2019-02-21T20:25:19+0000
https://artsbeat.blogs.nytimes.com/2012/09/25/in-paris-an-exhibition-dedicated-to-hair/,"In Paris, an Exhibition Dedicated to Hair",2012-09-25T19:04:21+0000
https://www.nytimes.com/2023/04/05/style/mielle-organics-rosemary-hair-oil.html,Who Gets to Use a Hair Oil?,2023-04-05T22:00:09+0000
https://www.nytimes.com/2016/12/26/fashion/black-hair-care-app-swivel.html,An App to Help Black Women With Hair Care,2016-12-26T11:00:24+0000
https://www.nytimes.com/2014/05/01/opinion/when-black-hair-is-against-the-rules.html,When Black Hair Is Against the Rules,2014-04-30T22:57:00+0000
https://www.nytimes.com/2012/06/01/opinion/black-women-and-natural-hair.html,Black Women’s Transitions to Natural Hair,2012-05-31T21:11:39+0000
https://www.nytimes.com/2022/10/27/arts/television/the-hair-tales-hulu-own.html,‘The Hair Tales’: Stories of Black Women’s Hair and Self-Acceptance,2022-10-27T19:00:09+0000
https://www.nytimes.com/2022/07/21/books/african-american-dictionary.html,"Hip, Woke, Cool: It’s All Fodder For the Oxford Dictionary of African American English",2022-07-21T09:00:07+0000
https://www.nytimes.com/2018/02/23/opinion/sunday/natural-hair-black-panther.html,Black Hair’s Blockbuster Moment,2018-02-24T00:31:06+0000
https://lens.blogs.nytimes.com/2016/05/26/honoring-the-legacy-of-african-american-women/,Honoring the Legacy of African-American Women,2016-05-26T07:00:58+0000
https://www.nytimes.com/2020/10/28/movies/black-women-horror-hair.html,Black Women’s Hair and Horror Movies: What Could Go Wrong?,2020-10-28T21:06:30+0000
https://www.nytimes.com/2019/05/04/opinion/sunday/travel-blacks-africa.html,The Trip I Hope All African-Americans Can Take,2019-05-04T18:30:06+0000
https://www.nytimes.com/2011/05/30/arts/dance/danceafrica-at-brooklyn-academy-of-music-review.html,"The Dances of Africa, as Filtered Through the Americas",2011-05-29T21:37:22+0000
https://www.nytimes.com/2017/04/09/us/our-tangled-world-of-hair.html,Our Tangled World of Hair,2017-04-09T17:06:09+0000
https://www.nytimes.com/2023/05/23/style/african-american-english-oxford-dictionary.html,The First 10 Words of the African American English Dictionary Are In,2023-05-23T09:00:17+0000
https://www.nytimes.com/2013/05/20/books/americanha-by-chimamanda-ngozi-adichie.html,Braiding Hair and Issues About Race,2013-05-19T20:27:05+0000
https://www.nytimes.com/2011/08/16/business/natural-hair-pat-downs-warrant-a-rethinking.html,"With Hair Pat-Downs, Complaints of Racial Bias",2011-08-16T00:10:25+0000
https://www.nytimes.com/2018/11/15/style/combing-my-hair-and-finding-myself.html,Combing My Hair and Finding Myself,2018-11-15T10:00:07+0000
https://www.nytimes.com/2021/12/09/style/black-women-hair-care.html,Black Women Make Waves in Hair Care,2021-12-09T08:00:10+0000
https://www.nytimes.com/2023/05/20/business/lionel-harris-brownie-blendz-the-shop.html,Inside the Life of Influencer Barbers,2023-05-20T09:00:51+0000
https://www.nytimes.com/2013/09/18/opinion/friedman-the-man-with-pink-hair.html,The Man With Pink Hair,2013-09-18T01:07:08+0000
https://www.nytimes.com/2020/09/24/style/wigs-coronavirus.html,Now’s the Time for Wigs. If You Can Get the Hair for Them.,2020-09-24T07:00:07+0000
https://www.nytimes.com/2021/05/10/t-magazine/black-hair-care-natural.html,The Brands Reimagining Natural Hair Care,2021-05-10T09:00:16+0000
https://www.nytimes.com/2020/06/10/business/walmart-black-hair-beauty-products.html,Walmart Says It Will No Longer Lock Up African-American Beauty Products,2020-06-11T03:43:23+0000
https://www.nytimes.com/2021/03/29/theater/crowns-kinks-and-curls-review.html,"Review: In ‘Crowns, Kinks and Curls,’ Getting to the Roots of Black Hair",2021-03-29T20:03:52+0000
https://www.nytimes.com/2019/12/20/us/nj-hair-discrimination.html,New Jersey Is Third State to Ban Discrimination Based on Hair,2019-12-20T23:59:19+0000
https://www.nytimes.com/2019/06/28/us/natural-hair-discrimination-ban.html,California Is First State to Ban Discrimination Based on Natural Hair,2019-06-28T21:48:48+0000
https://www.nytimes.com/2022/04/05/movies/oscars-black-hair-chris-rock.html,One Last Takeaway From ‘The Slap’: Leave Black Women’s Hair Alone,2022-04-05T23:04:02+0000
https://www.nytimes.com/2017/07/19/fashion/beauty/curlfest-a-celebration-of-curl-confidence.html,"At Curlfest, a Celebration of Natural Hair and Black Beauty",2017-07-19T04:01:58+0000
https://www.nytimes.com/2011/04/19/health/research/19hazards.html,Hazards: More Culprits in Hair Loss Than Just the Salon,2011-04-15T20:24:10+0000
https://well.blogs.nytimes.com/2011/08/25/surgeon-general-calls-for-health-over-hair/,Surgeon General Calls for Health Over Hair,2011-08-25T21:52:27+0000
https://www.nytimes.com/2018/08/29/opinion/black-hair-girls-shaming.html,Why Are Black People Still Punished for Their Hair? ,2018-08-29T17:21:40+0000
https://www.nytimes.com/2016/03/24/arts/international/grappling-with-hair-issues.html,Grappling With Hair Issues,2016-03-24T15:08:24+0000
https://www.nytimes.com/2020/04/11/style/how-to-care-for-your-relaxed-hair-at-home.html,How to Care for Your Relaxed Hair at Home,2020-04-11T09:00:05+0000
https://www.nytimes.com/2018/02/14/style/black-panther-natural-hair.html,How ‘Black Panther’ Got Its Gorgeous Afrocentric Hair,2018-02-14T10:00:34+0000
https://www.nytimes.com/2019/12/04/health/cancer-hair-dye-black-women.html,Hair Dyes and Straighteners May Raise Breast Cancer Risk for Black Women,2019-12-05T00:09:41+0000
https://www.nytimes.com/2020/11/11/business/ups-black-natural-hair.html,UPS to Allow Natural Black Hairstyles and Facial Hair,2020-11-12T01:29:37+0000
https://www.nytimes.com/2020/04/16/parenting/child-hair.html,Why Do Moms Obsess Over Their Kids’ Hair?,2020-04-17T02:18:39+0000
https://www.nytimes.com/2012/06/17/magazine/so-you-think-you-can-be-a-hair-braider.html,So You Think You Can Be a Hair Braider?,2012-06-12T09:00:01+0000
https://www.nytimes.com/2012/02/10/arts/design/henry-ossawa-tanner-at-pennsylvania-academy-of-fine-arts.html,An African-American Painter Who Tried to Transcend Race,2012-02-09T22:46:15+0000
https://www.nytimes.com/2020/05/27/opinion/coronavirus-hair-care.html,Lockdown Taught Me to Care for My Natural Hair,2020-05-27T19:00:10+0000
https://www.nytimes.com/2018/02/18/nyregion/president-washington-hair-discovered.html,"Finding a Lock of George Washington’s Hair, and a Link to American History",2018-02-18T18:38:55+0000
https://www.nytimes.com/2013/08/01/fashion/a-truce-in-hand-to-hair-combat.html,A Truce in Hand-to-Hair Combat,2013-08-01T01:06:59+0000
https://www.nytimes.com/2019/02/18/style/hair-discrimination-new-york-city.html,New York City to Ban Discrimination Based on Hair,2019-02-18T10:00:02+0000
https://www.nytimes.com/2012/05/09/business/media/unilever-introduces-its-clear-hair-products-in-america.html,Clear Hair Products Enter a Cluttered Market,2012-05-09T01:00:24+0000
https://www.nytimes.com/2022/04/28/movies/natural-black-hairstyles-hollywood.html,"In Films and on TV, a New Openness to Natural Black Hairstyles",2022-04-28T14:00:12+0000
https://www.nytimes.com/2022/09/06/sports/soul-cap-swimming-fina.html,Swimming Federation Reverses Ban on Swim Cap Designed for Black Hair,2022-09-06T19:44:09+0000
https://www.nytimes.com/2010/09/12/fashion/12Curley.html,Gimme Hair Flying Straight and Free,2010-09-11T02:00:29+0000
https://www.nytimes.com/2021/02/26/us/army-haircut-women-grooming-standard.html,"In a Changing Military, the Army Eases Its Rules for Women’s Hair",2021-02-26T08:00:07+0000
https://www.nytimes.com/2021/05/13/us/north-carolina-high-school-hair-beads.html,Black Student Athlete Was Forced to Remove Hair Beads During Game,2021-05-13T22:47:13+0000
https://www.nytimes.com/2019/11/12/nyregion/nyc-salon-racial-natural-hair-discrimination.html,Salon Accused of Bias Will Be Taught to Style Black Hair,2019-11-13T04:56:40+0000
https://www.nytimes.com/2021/05/10/t-magazine/black-hair-weaves-wigs.html,The Joy of Black Hair,2021-05-10T09:03:20+0000
https://www.nytimes.com/2014/10/11/business/comer-cottrell-pioneer-of-hair-products-for-blacks-dies-at-82.html,"Comer Cottrell, Who Got Rich on Hair Curling, Dies at 82",2014-10-11T22:10:53+0000
https://www.nytimes.com/2010/11/22/business/global/22blond.html,"For Russia’s Poor, Blond Hair Is Snippet of Gold",2010-11-22T01:41:33+0000
https://www.nytimes.com/2016/01/07/travel/reader-response-a-natural-hair-salon-in-santo-domingo.html,Reader Response: A Natural Hair Salon in Santo Domingo,2016-01-07T17:29:20+0000
https://www.nytimes.com/2020/03/17/books/review/that-hair-djaimilia-pereira-de-almeida.html,"For Black and Mixed-Race Women, Hair and Identity Are Tangled Together",2020-03-17T09:00:08+0000
https://www.nytimes.com/2022/10/17/health/hair-straighteners-black-women-cancer.html,"Hair Straighteners May Pose a Small Risk for Uterine Cancer, Study Finds",2022-10-17T21:41:56+0000
https://parenting.blogs.nytimes.com/2015/05/28/why-i-stopped-giving-hair-advice-to-white-moms-of-brown-kids/,Why I Stopped Giving Hair Advice to White Moms of Brown Kids,2015-05-28T12:17:31+0000
https://www.nytimes.com/2022/08/09/style/knotless-braids-hairstyle.html,The Rise of Knotless Braids,2022-08-09T19:00:13+0000
https://www.nytimes.com/2018/06/14/books/review/i-love-my-black-hair-natasha-tarpley.html,Why Do Kids’ Books About Black Hair Draw So Much Attention — and Controversy?,2018-06-14T19:00:05+0000
https://www.nytimes.com/video/us/100000008019776/police-body-camera-black-man-traffic-stop-dayton-ohio.html,Video Shows Police Pulling Man Out of Car by Hair During Traffic Stop,2021-10-11T23:38:57+0000
https://www.nytimes.com/2017/11/10/style/lupita-hair-grazia.html,Lupita Nyong’o Criticizes Magazine’s Altered Image of Her Hair,2017-11-10T19:31:02+0000
https://www.nytimes.com/2015/08/19/arts/design/tony-gleaton-67-dies-leaving-legacy-in-pictures-of-africans-in-the-americas.html,"Tony Gleaton, 67, Dies, Leaving Legacy in Pictures of Africans in the Americas ",2015-08-19T01:28:42+0000
https://www.nytimes.com/2020/02/09/movies/hair-love-oscars-animated-short.html,‘Hair Love’ Receives a Lot of Love at the Oscars for Best Animated Short Film,2020-02-10T01:38:16+0000
https://www.nytimes.com/2021/04/25/movies/ma-raineys-black-bottom-mia-neal-jamika-wilson.html,Mia Neal and Jamika Wilson are the first Black women to win for hair and makeup.,2021-04-26T01:11:18+0000
https://www.nytimes.com/2018/12/18/obituaries/galt-macdermot-dead.html,"Galt MacDermot, Composer of the Rock Musical ‘Hair,’ Dies at 89",2018-12-18T22:33:39+0000
https://www.nytimes.com/2017/04/14/arts/design/one-artists-melancholy-look-at-missing-african-american-women.html,One Artist’s Melancholy Look at Missing African-American Women,2017-04-14T20:57:10+0000
https://www.nytimes.com/2019/08/29/movies/hair-love.html,‘Hair Love’: 3 Men and a Little Girl (With a Lot of Curls),2019-08-29T19:41:48+0000
https://www.nytimes.com/2019/12/09/travel/ghana-african-slave-trade-jacqueline-woodson.html,"Jacqueline Woodson on Africa, America and Slavery’s Fierce Undertow",2019-12-09T10:00:19+0000
https://www.nytimes.com/interactive/2019/obituaries/alfred-hair-overlooked.html,"Alfred Hair, Whose Collective Created a Path for Black Artists",2019-02-01T00:28:50+0000
https://www.nytimes.com/2022/11/18/theater/michael-butler-dead.html,"Michael Butler, Who Brought ‘Hair’ to Broadway, Dies at 95",2022-11-18T16:23:05+0000
https://www.nytimes.com/2020/04/23/theater/musical-cast-album-hair.html,A Cast Album I Love: ‘Hair’,2020-04-23T18:18:19+0000
https://www.nytimes.com/2018/08/21/us/black-student-extensions-louisiana.html,Black Girl Sent Home From School Over Hair Extensions,2018-08-22T00:40:08+0000
https://www.nytimes.com/2014/04/30/us/hagel-seeks-review-of-military-policies-on-hairstyles.html,Hagel Seeks Review of Military Policies on Hairstyles,2014-04-30T00:30:10+0000
https://www.nytimes.com/2016/12/02/books/review/entanglement-emma-tarlo-hair-john-barrett.html,"Locks, Mops and Bouffants: Two Books on Hair",2016-12-02T16:15:22+0000
https://www.nytimes.com/2022/09/24/sports/football/nfl-locs-braids-black-hair.html,"For Dreadlocked N.F.L. Players, Hair Is a Point of Pride",2022-09-24T04:01:08+0000
https://www.nytimes.com/2020/06/25/nyregion/nyc-barber-shops-coronavirus.html,3 Long (Haired) Months: Barbershop Before-and-Afters,2020-06-25T14:53:45+0000
https://www.nytimes.com/2022/06/06/style/self-care/nikki-walton-curlynikki-hair-spirituality.html,"For Nikki Walton, Writing About Hair Was Just Step 1",2022-06-06T13:23:19+0000
https://www.nytimes.com/interactive/2019/08/14/magazine/african-american-poets.html,A New Literary Timeline of African-American History,2019-08-14T04:27:18+0000
https://www.nytimes.com/2021/08/17/arts/design/smithsonian-rare-photographs-black-daguerreotype.html,Smithsonian Acquires Rare Photographs From the First African American Studios,2021-08-17T16:20:45+0000
https://www.nytimes.com/2015/05/31/nyregion/brooklyn-hamlet-of-free-african-americans-was-ahead-of-its-time.html,Brooklyn Hamlet of Free African-Americans Was Ahead of Its Time,2015-05-29T20:46:41+0000
https://www.nytimes.com/2016/12/25/arts/design/smithsonian-museum-african-american-museum-history-culture-wesley-morris.html,"Visiting the African-American Museum: Waiting, Reading, Thinking, Connecting, Feeling",2016-12-25T21:19:37+0000
https://www.nytimes.com/2019/11/20/arts/design/baltimore-museum-artists.html,Meet the Artists in Mickalene Thomas’s Orbit,2019-11-20T15:00:10+0000
https://www.nytimes.com/2015/05/27/opinion/on-being-african-in-europe.html,On Being African in Europe,2015-05-26T09:56:58+0000
https://www.nytimes.com/2012/04/29/us/at-this-atlanta-barbershop-the-conversation-goes-on-24-7.html,"At This Atlanta Barbershop, the Conversation Goes on 24/7",2012-04-28T18:25:32+0000
https://dealbook.nytimes.com/2012/05/28/in-cambodia-a-start-up-uses-the-internet-to-sell-hair/,"In Cambodia, a Start-Up Combines Web Sales Skills and Hair Extensions",2012-05-28T17:45:36+0000
https://www.nytimes.com/2010/04/16/arts/design/16african.html,The Exotic in the Eyes of African Beholders,2010-04-15T21:02:58+0000
https://www.nytimes.com/2020/12/03/arts/design/john-edmonds-ghana-brooklyn-museum.html,John Edmonds and the Allure of Africa,2020-12-03T15:14:45+0000
https://www.nytimes.com/2018/04/02/fashion/braids-weaves-extensions-and-traction-alopecia.html,What Black Women Need to Know About Hair Loss,2018-04-02T18:02:16+0000
https://www.nytimes.com/2011/06/09/fashion/hair-care-for-african-americans.html,‘Going Natural’ Requires Lots of Help,2011-06-08T16:46:26+0000
https://www.nytimes.com/2018/09/13/us/african-americans-hurricane-florence-displacement.html,Hurricane Florence and the Displacement of African-Americans Along the Carolina Coast,2018-09-13T20:01:45+0000
https://www.nytimes.com/2015/11/25/insider/into-africa-new-west-africa-bureau-chief-makes-herself-at-home.html,Into Africa: New West Africa Bureau Chief Makes Herself at Home,2015-11-24T18:50:29+0000
https://www.nytimes.com/2016/08/14/fashion/an-african-city-sex-and-the-city.html,A ‘Sex and the City’ for African Viewers,2016-08-13T10:00:05+0000
https://www.nytimes.com/2013/06/16/nyregion/for-decades-cutting-hair-and-winning-fans.html,"For Decades, Cutting Hair and Winning Fans",2013-06-14T03:26:28+0000
https://www.nytimes.com/2018/06/12/arts/design/yinka-shonibare-exhibition-london.html,"It’s Time for African Resistance, This Artist Says",2018-06-12T11:37:11+0000
https://www.nytimes.com/2020/11/16/learning/should-schools-or-employers-be-allowed-to-tell-people-how-they-should-wear-their-hair.html,Should Schools or Employers Be Allowed to Tell People How They Should Wear Their Hair?,2020-11-16T10:00:05+0000
https://www.nytimes.com/2015/06/28/fashion/girls-ideal-hair-long-sleek-high-school-approved.html,"Hair That’s Long, Sleek, High School Approved",2015-06-26T09:45:15+0000
https://www.nytimes.com/2014/05/30/opinion/mutiga-pan-africanism-and-the-world-cup.html,Pan-Africanism and the World Cup,2014-05-29T10:48:45+0000
https://www.nytimes.com/2022/08/20/style/latisha-chong-dead.html,"Latisha Chong, Hair Stylist Who Helped Change Fashion, Dies at 32",2022-08-20T21:23:04+0000
https://www.nytimes.com/2019/02/23/style/sharon-dorram-color-sally-hershberger-hair-discrimination.html,Upper East Side Salon Under Investigation for Racial Discrimination,2019-02-23T12:55:15+0000
https://www.nytimes.com/2016/02/19/world/africa/with-a-boom-before-the-cameras-nigeria-redefines-african-life.html,Nigeria’s Booming Film Industry Redefines African Life,2016-02-18T10:00:28+0000
https://www.nytimes.com/2014/03/13/fashion/african-oils-exotic-and-in-demand.html,"African Oils, Exotic and in Demand",2014-03-12T23:12:23+0000
https://lens.blogs.nytimes.com/2015/05/26/blending-french-and-african-identities/,Blending French and African Identities,2015-05-26T07:00:52+0000
https://www.nytimes.com/2011/01/12/movies/12danger.html,Raw View of African Cure for Addiction to Drugs,2011-01-11T23:32:41+0000
https://www.nytimes.com/2016/06/12/fashion/prom-dresses-african-style.html,"Rocking It on Prom Night, African Style",2016-06-11T10:00:26+0000
https://www.nytimes.com/2013/01/01/world/africa/ruthless-smuggling-rings-put-rhinos-in-the-cross-hairs.html,"Coveting Horns, Ruthless Smugglers’ Rings Put Rhinos in the Cross Hairs",2012-12-31T16:53:17+0000
https://www.nytimes.com/2021/10/11/us/ohio-police-paraplegic-stop.html,"Police Officer Drags Man by Hair From Car. ‘I’m Paraplegic,’ He Protests.",2021-10-11T22:04:05+0000
https://www.nytimes.com/2020/06/17/us/delbert-africa-dead.html,"Delbert Africa, 74, Convicted in Radical Group’s Clash With Police, Dies",2020-06-17T23:20:48+0000
https://www.nytimes.com/2019/09/10/business/joan-johnson.html,"Joan Johnson, Whose Company Broke a Racial Barrier, Dies at 89",2019-09-10T21:40:56+0000
https://www.nytimes.com/2018/12/01/health/sickle-cell-hydroxyurea-africa.html,‘From Nothing to Gangbusters’: A Treatment for Sickle-Cell Disease Proves Effective in Africa,2018-12-01T15:30:04+0000
https://www.nytimes.com/2023/07/18/world/europe/putin-south-africa.html,South Africa Skirts Dilemma After Putin Cancels Visit,2023-07-18T19:18:08+0000
https://www.nytimes.com/2010/05/24/sports/soccer/24safrica.html,South Africa Pushes to Make the Cup Its Own,2010-05-24T01:51:24+0000
https://www.nytimes.com/2023/02/11/world/africa/aka-kiernan-forbes-rapper-dead.html,"AKA, Influential South African Rapper, Is Fatally Shot",2023-02-11T12:42:00+0000
https://www.nytimes.com/2014/09/24/t-magazine/bangs-beauty-trend.html,Fringe Benefits,2014-09-24T04:00:00+0000
https://www.nytimes.com/2020/06/11/science/jaguars-poaching-china.html,"Where Jaguars Are Killed, New Common Factor Emerges: Chinese Investment",2020-06-11T13:24:26+0000
https://www.nytimes.com/2023/09/06/style/pirelli-calendar-prince-gyasi.html,A Landmark Year for a Rare Calendar,2023-09-06T16:00:19+0000
https://www.nytimes.com/2016/08/14/books/review/teju-cole-known-and-strange-things.html,Teju Cole’s Essays Build Connections Between African and Western Art,2016-08-09T09:30:04+0000
https://www.nytimes.com/2022/12/24/world/africa/central-african-republic-russia-wagner.html,"Putin Wants Fealty, and He’s Found It in Africa",2022-12-24T10:00:51+0000
https://www.nytimes.com/interactive/2020/05/16/magazine/covid-quarantine-hair-braids.html,"When the World Unravels, Braid Your Own Hair",2020-05-16T09:00:01+0000
https://www.nytimes.com/2020/07/02/arts/music/keleketla-review.html,Coldcut + Tony Allen and African Artists = Studio Electricity,2020-07-02T18:13:54+0000
https://www.nytimes.com/2020/03/03/us/racist-Oklahoma-Christian-University-recruiter.html,Oklahoma College Recruiter Lined Up High School Students by Skin Color and Hair Type,2020-03-03T19:08:50+0000
https://www.nytimes.com/2023/02/10/opinion/trump-desantis-transgender-rights.html,There Is No Dignity in This Kind of America,2023-02-10T10:00:29+0000
https://www.nytimes.com/2020/07/04/style/black-in-america-through-a-camera.html,"Black in America, Through a Camera",2020-07-04T15:46:34+0000
https://www.nytimes.com/2019/09/20/world/africa/xenophobia-nigerians-south-africa.html,Anti-Immigrant Venom Killed Their South African Dreams,2019-09-20T09:00:21+0000
https://www.nytimes.com/2023/02/04/us/politics/isis-somalia-kabul-bombing.html,Ties to Kabul Bombing Put ISIS Leader in Somalia in U.S. Cross Hairs,2023-02-04T10:00:21+0000
https://www.nytimes.com/2020/12/02/arts/zanele-muholi-tate-modern.html,Zanele Muholi Walks In With the Ancestors,2020-12-02T10:00:33+0000
https://www.nytimes.com/2021/06/17/world/africa/kenneth-kaunda-dead.html,"Kenneth Kaunda, Patriarch of African Independence, Is Dead at 97",2021-06-17T17:52:35+0000
https://www.nytimes.com/2018/01/19/nyregion/refugee-elizabeth-congo-trump.html,"Leaving Africa, and Living in Limbo",2018-01-19T10:00:04+0000
https://www.nytimes.com/2013/06/28/business/media/on-the-concert-stage-bet-festival-offers-a-broad-brand-experience.html,"On the Concert Stage, BET Festival Offers a Broad Brand Experience",2013-06-28T01:51:25+0000
https://www.nytimes.com/2016/04/15/movies/barbershop-the-next-cut-review.html,Review: ‘Barbershop: The Next Cut’: Let the Debates Resume,2016-04-14T19:33:34+0000
https://www.nytimes.com/2019/08/09/arts/music/sho-madjozi.html,"Sho Madjozi’s Mixed Up, Pan-African Rap",2019-08-09T12:38:47+0000
https://www.nytimes.com/2017/10/18/obituaries/cornelia-bailey-champion-of-african-rooted-culture-in-coastal-georgia-dies-at-72.html,"Cornelia Bailey, Champion of African-Rooted Culture in Coastal Georgia, Dies at 72",2017-10-18T21:14:09+0000
https://www.nytimes.com/2020/08/10/t-magazine/sonya-clark-flags-art.html,The Artist Unraveling American History,2020-08-10T11:00:24+0000
https://www.nytimes.com/2022/12/28/world/africa/south-africa-black-teenagers-pool.html,White Men Charged in Attack on Black Teenagers at Pool in South Africa,2022-12-28T23:10:40+0000
https://www.nytimes.com/2018/05/15/style/serena-williams-beauty-routine.html,Serena Williams Has a Genius Eyebrow Hack,2018-05-15T09:00:01+0000
https://www.nytimes.com/2015/07/05/magazine/americas-postracial-fantasy.html,America’s ‘Postracial’ Fantasy,2015-06-30T11:00:05+0000
https://www.nytimes.com/paidpost/dorchester-collection/a-south-african-soprano-fuses-technique-with-raw-emotion.html,A South African Soprano Fuses Technique With Raw Emotion,2019-10-28T17:12:33+0000
https://www.nytimes.com/2016/12/13/travel/africa-road-trip-in-16-days.html,Seeing Africa by Road,2016-12-13T11:00:07+0000
https://www.nytimes.com/2019/05/20/arts/cannes-film-festival-black-director.html,The First Black Woman to Compete at Cannes Finds Her Voice in Africa,2019-05-20T17:58:50+0000
https://www.nytimes.com/2017/02/14/business/american-girls-new-doll-its-a-boy.html,American Girl’s New Doll: It’s a Boy!,2017-02-15T00:36:55+0000
