web_url,headline,pub_date
https://www.nytimes.com/2023/12/01/theater/carte-noire-named-desire-paris.html,"A Play About Black Women’s Experiences, Met With Violence",2023-12-01T16:24:53+0000
https://www.nytimes.com/2019/08/11/opinion/ebony-jet-magazine.html,The Radical Blackness of Ebony Magazine,2019-08-11T23:10:08+0000
https://www.nytimes.com/2013/11/27/nyregion/suit-claims-racial-harassment-at-security-firm-with-new-york-city-contracts.html,Suit Claims Racial Harassment at Security Firm With New York City Contracts,2013-11-27T03:01:28+0000
https://www.nytimes.com/2016/01/31/magazine/can-i-call-my-nonbiological-twins-black-because-my-husband-is.html,Can I Call My Nonbiological Twins Black Because My Husband Is?,2016-01-27T12:00:03+0000
https://www.nytimes.com/2022/12/16/world/europe/uk-royal-racism.html,Former Palace Aide Makes Face-to-Face Apology to Guest Over Remarks,2022-12-16T19:45:10+0000
https://www.nytimes.com/2017/03/09/us/diamond-reynolds-assault-charge.html,Woman Who Streamed Boyfriend’s Death by Police Faces Unrelated Assault Charge,2017-03-09T17:36:26+0000
https://www.nytimes.com/2018/05/12/world/europe/meghan-markle-prince-harry-royal-wedding-race.html,What Meghan Markle Means to Black Britons,2018-05-12T07:01:05+0000
https://www.nytimes.com/2010/04/15/fashion/15skin.html,Unshaven Women: Free Spirits or Unkempt?,2010-04-12T22:30:17+0000
https://www.nytimes.com/2010/04/15/fashion/15skin.html,Unshaven Women: Free Spirits or Unkempt?,2010-04-12T22:30:17+0000
https://www.nytimes.com/2022/01/22/us/ami-cole-beauty-products.html,Ami Colé Fills a Void In Black Beauty Products,2022-01-22T10:00:11+0000
https://www.nytimes.com/2019/01/20/world/africa/united-nations-peacekeepers-killed-mali.html,Al Qaeda Claims U.N. Peacekeeper Attack That Killed 10 in Mali,2019-01-20T21:55:48+0000
https://www.nytimes.com/2018/10/29/us/parenting-motherhood-son-black-codes.html,Why I Won’t Teach My Son ‘Black Codes’,2018-10-29T09:00:01+0000
https://www.nytimes.com/2017/08/09/magazine/what-a-fraternity-hazing-death-revealed-about-the-painful-search-for-an-asian-american-identity.html,What a Fraternity Hazing Death Revealed About the Painful Search for an Asian-American Identity,2017-08-09T09:00:07+0000
https://www.nytimes.com/2014/09/21/magazine/how-gary-harts-downfall-forever-changed-american-politics.html,How Gary Hart’s Downfall Forever Changed American Politics,2014-09-18T09:00:06+0000
https://www.nytimes.com/interactive/2014/theater/big-wigs-of-broadway-interactive.html,The Big Wigs of Broadway,2014-05-09T18:25:02+0000
https://www.nytimes.com/2012/11/11/magazine/the-oklahoma-city-thunders-fairy-tale-rise.html,A Basketball Fairy Tale in Middle America,2012-11-08T12:00:55+0000
https://www.nytimes.com/2016/08/18/fashion/olympics-hair-style-simone-biles-aly-raisman.html,Olympian Style Inspires Kids — and Some Adults,2016-08-17T15:10:11+0000
https://www.nytimes.com/2020/06/12/us/politics/west-point-sikh-anmol-narang.html,Latest Crop of West Point Graduates Includes First Observant Sikh Cadet,2020-06-13T02:46:03+0000
https://www.nytimes.com/2016/02/18/us/politics/blacks-see-bias-in-delay-on-antonin-scalia-successor.html,Blacks See Bias in Delay on a Scalia Successor,2016-02-18T02:28:24+0000
https://www.nytimes.com/2023/12/07/world/europe/benjamin-zephaniah-dead.html,"Benjamin Zephaniah, Poet of Social Justice Issues, Dies at 65",2023-12-07T19:00:36+0000
https://www.nytimes.com/2017/02/22/learning/should-there-be-more-boy-dolls.html,Should There Be More Boy Dolls?,2017-02-22T10:00:02+0000
https://www.nytimes.com/2019/03/10/us/politics/us-somalia-airstrikes-shabab.html,Trump Administration Steps Up Air War in Somalia,2019-03-10T20:41:27+0000
https://www.nytimes.com/2015/01/27/world/africa/dominic-ongwen-lords-resistance-army-war-crimes-court-hague.html,Former Lord’s Resistance Army Commander Appears at War Crimes Court,2015-01-26T19:32:29+0000
https://www.nytimes.com/2017/01/23/learning/what-have-you-learned-from-the-women-in-your-life.html,What Have You Learned From the Women in Your Life?,2017-01-23T10:00:03+0000
https://www.nytimes.com/2016/03/18/nyregion/baseball-practice-with-the-super.html,Baseball Practice With the Super,2016-03-18T12:59:14+0000
https://www.nytimes.com/interactive/2019/obituaries/scott-joplin-overlooked.html,"Scott Joplin, Ragtime Master Who Wrote ‘The Entertainer’",2019-02-01T00:29:02+0000
https://www.nytimes.com/interactive/2019/obituaries/major-taylor-overlooked.html,"Major Taylor, World Champion Bicyclist",2019-02-01T00:28:19+0000
https://www.nytimes.com/interactive/2019/obituaries/moses-fleetwood-walker-overlooked.html,Moses Fleetwood Walker,2019-02-01T00:28:24+0000
https://www.nytimes.com/politics/first-draft/2014/10/09/supreme-court-decision-may-help-north-carolina-republican/,Supreme Court Decision May Help North Carolina Republican,2014-10-09T16:35:03+0000
https://www.nytimes.com/interactive/2019/obituaries/philip-a-payton-jr-overlooked.html,"Philip Payton, the Real Estate Mogul Who Made Harlem a Black Mecca",2019-02-01T00:28:28+0000
https://www.nytimes.com/2022/02/14/books/review-black-cloud-rising-david-wright-falade.html,A Rousing Novel Follows a Brigade of Black Soldiers in the Civil War,2022-02-14T19:30:43+0000
https://www.nytimes.com/2013/04/19/business/media/celebrating-black-beauty-and-advocating-diversity.html,Celebrating Black Beauty and Advocating Diversity,2013-04-19T01:39:56+0000
https://www.nytimes.com/2017/11/04/style/monrovia-hipco-clubs.html,The Ease of Monrovia’s ‘Hipco’ Clubs,2017-11-04T10:00:30+0000
https://www.nytimes.com/2014/05/01/fashion/the-bob-and-the-pixie-become-the-spring-haircuts-of-choice-for-some-women.html,A Shortcut to Spring,2014-04-30T22:07:47+0000
https://www.nytimes.com/2020/04/15/parenting/fertility/black-women-uterine-fibroids.html,Black Women Are Hit Hardest by Fibroid Tumors,2020-04-15T12:03:31+0000
https://www.nytimes.com/2017/11/20/opinion/charles-manson-counterculture.html,Charles Manson Was Not a Product of the Counterculture,2017-11-20T21:31:00+0000
https://www.nytimes.com/2019/04/20/opinion/cultural-appropriation-coachella.html,Finding the Beauty in Cultural Appropriation,2019-04-20T18:30:15+0000
https://www.nytimes.com/2023/03/24/climate/air-pollution-pm25-health-effects.html,Cleaner Air Helps Everyone. It Helps Black Communities a Lot.,2023-03-24T16:06:40+0000
https://www.nytimes.com/2023/03/24/climate/air-pollution-pm25-health-effects.html,Cleaner Air Helps Everyone. It Helps Black Communities a Lot.,2023-03-24T16:06:40+0000
https://www.nytimes.com/2018/07/24/arts/design/show-us-your-wall-denise-and-gary-gardner.html,"Championing Black Artists, at Home and in the Spotlight",2018-07-24T17:35:39+0000
https://www.nytimes.com/2022/10/25/arts/design/maxwell-alexandre-art-shed-brazil.html,How Rollerblading Propelled Maxwell Alexandre’s Art Career,2022-10-25T17:08:49+0000
https://www.nytimes.com/interactive/2019/obituaries/granville-t-woods-overlooked.html,"Granville T. Woods, Inventor Known as ‘Black Edison’",2019-02-01T00:28:43+0000
https://www.nytimes.com/2018/10/30/world/europe/france-nantes-slave-trade-museum-memorial.html,"‘They Threw Themselves Into the Sea, 14 Black Women, All Together’",2018-10-30T09:00:09+0000
https://www.nytimes.com/2018/05/20/opinion/meghan-markle-royal-wedding-race.html,"Thanks, Meghan Markle, We Needed That",2018-05-20T18:53:56+0000
https://www.nytimes.com/2016/01/14/opinion/the-other-obama-legacy.html,The Other Obama Legacy,2016-01-14T08:21:23+0000
https://www.nytimes.com/2017/07/25/magazine/is-being-unapologetic-the-new-patriotic-or-a-form-of-resistance.html,Is Being ‘Unapologetic’ the New Patriotic — or a Form of Resistance?,2017-07-25T09:00:24+0000
https://www.nytimes.com/2022/03/25/t-magazine/marcus-brutus-harpers.html,"Two Men Walk Into a Barbershop, as Envisioned by Marcus Brutus",2022-03-25T17:32:57+0000
https://www.nytimes.com/interactive/2019/obituaries/oscar-micheaux-overlooked.html,"Oscar Micheaux, Intrepid Creator of Films on Race",2019-02-01T00:28:39+0000
https://parenting.blogs.nytimes.com/2010/06/08/describing-grief/,Describing Grief,2010-06-08T14:18:30+0000
https://www.nytimes.com/2010/09/16/arts/design/16honeywood.html,"Varnette Honeywood, Whose Art Appeared on ‘Cosby Show,’ Dies at 59",2010-09-16T04:44:54+0000
https://www.nytimes.com/2018/09/11/style/beauty-diversity.html,Beauty Is More Diverse Than Ever. But Is It Diverse Enough?,2018-09-11T21:52:47+0000
https://www.nytimes.com/2021/06/28/business/economy/black-workers-racial-pay-gap.html,Black Workers Stopped Making Progress on Pay. Is It Racism?,2021-06-28T07:00:08+0000
https://www.nytimes.com/2018/02/12/sports/olympics/olympics-diversity-Maame-Biney-Fenlator-Victorian-Adigun.html,"Online, a Diverse Winter Olympics. But on the Ground?",2018-02-12T07:08:51+0000
https://www.nytimes.com/interactive/2019/obituaries/elizabeth-jennings-overlooked.html,"Elizabeth Jennings, Who Desegregated New York’s Trolleys",2019-02-01T00:28:32+0000
https://www.nytimes.com/2020/03/04/opinion/black-women-plastic-surgery-natural.html,What Women Who Criticize Plastic Surgery Don’t See,2020-03-04T21:31:10+0000
https://www.nytimes.com/interactive/2019/obituaries/zelda-wynn-valdes-overlooked.html,"Zelda Wynn, Fashion Designer to the Stars",2019-02-01T00:28:55+0000
https://www.nytimes.com/interactive/2019/obituaries/nina-mae-mckinney-overlooked.html,"Nina Mae McKinney, Who Defied the Barriers of Race to Find Stardom",2019-02-01T00:28:47+0000
https://www.nytimes.com/interactive/2019/obituaries/gladys-bentley-overlooked.html,"Gladys Bentley, Gender-Bending Blues Performer and ’20s Harlem Royalty",2019-02-01T00:29:06+0000
https://www.nytimes.com/interactive/2019/obituaries/black-history-month-overlooked.html,"For Black History Month, Remarkable Women and Men We Overlooked Since 1851",2019-02-01T00:28:15+0000
https://www.nytimes.com/interactive/2019/obituaries/mary-ellen-pleasant-overlooked.html,The Many Chapters of Mary Ellen Pleasant,2019-02-01T00:28:35+0000
https://www.nytimes.com/interactive/2019/obituaries/margaret-garner-overlooked.html,"Margaret Garner, a Runaway Slave Who Killed Her Own Daughter",2019-02-01T00:28:58+0000
https://www.nytimes.com/2014/11/09/books/review/christopher-paul-curtiss-madman-of-piney-woods.html,Christopher Paul Curtis’s ‘Madman of Piney Woods’,2014-11-07T16:52:18+0000
https://www.nytimes.com/2021/08/05/arts/design/social-works-gagosian-review.html,"At Gagosian, Art That Reverberates Beyond the Gallery Walls",2021-08-05T14:49:16+0000
https://www.nytimes.com/2020/06/16/magazine/how-should-i-think-about-race-when-considering-a-sperm-donor.html,How Should I Think About Race When Considering a Sperm Donor?,2020-06-16T09:00:08+0000
https://www.nytimes.com/2021/12/22/arts/dance/chyrstyn-fentroy-principal-dancer-boston-ballet.html,A Ballerina Who Adds to the ‘Palette of What’s Possible’,2021-12-22T15:00:08+0000
https://www.nytimes.com/2018/09/12/world/australia/serena-williams-cartoon-australian-newspaper.html,"Serena Williams Cartoon, Called Racist, Gets New Life on Paper’s Front Page",2018-09-12T05:39:41+0000
https://www.nytimes.com/2021/03/24/books/review-traveling-black-mia-bay.html,"‘Traveling Black,’ a Look at the Civil Rights Movement in Motion",2021-03-24T19:30:09+0000
https://www.nytimes.com/2020/04/10/arts/design/jesus-christ-image-easter.html,Searching for a Jesus Who Looks More Like Me,2020-04-10T09:00:34+0000
https://www.nytimes.com/2020/04/10/arts/design/jesus-christ-image-easter.html,Searching for a Jesus Who Looks More Like Me,2020-04-10T09:00:34+0000
https://www.nytimes.com/2010/12/05/magazine/05Dimon-t.html,Jamie Dimon: America’s Least-Hated Banker,2010-12-01T13:01:39+0000
https://www.nytimes.com/2015/06/29/nyregion/cases-of-passing-for-black-date-back-more-than-a-century.html,"Driven by Love or Ambition, Slipping Across the Color Line Through the Ages",2015-06-28T14:24:03+0000
https://www.nytimes.com/2017/09/15/books/roald-dahl-charlie-black.html,Roald Dahl’s Widow Says ‘Charlie and the Chocolate Factory’ Hero Was Supposed to be Black,2017-09-15T12:11:46+0000
https://parenting.blogs.nytimes.com/2012/10/28/what-color-is-your-princess/,What Color Is Your Princess?,2012-10-28T13:00:15+0000
https://www.nytimes.com/2019/04/16/magazine/consumer-financial-protection-bureau-trump.html,Mick Mulvaney’s Master Class in Destroying a Bureaucracy From Within,2019-04-16T09:00:20+0000
https://www.nytimes.com/2018/02/07/crosswords/daily-puzzle-2018-02-08.html,Word That Becomes Its Own Synonym,2018-02-08T03:00:01+0000
https://www.nytimes.com/2023/03/09/style/designers-wallpaper-cultural-history.html,When Pretty Walls Tell a Deeper Story,2023-03-09T10:00:44+0000
https://www.nytimes.com/2016/08/02/opinion/how-artists-change-the-world.html,How Artists Change the World,2016-08-02T07:21:26+0000
https://wordplay.blogs.nytimes.com/2014/11/04/place-for-high-living/,Place For High Living,2014-11-05T00:00:07+0000
https://www.nytimes.com/2018/01/12/arts/television/lorraine-hansberry-sighted-eyes-feeling-heart.html,"For Lorraine Hansberry, ‘A Raisin in the Sun’ Was Just the Start",2018-01-12T19:43:03+0000
https://www.nytimes.com/2012/05/24/us/politics/indelible-image-of-a-boys-pat-on-obamas-head-hangs-in-white-house.html,When a Boy Found a Familiar Feel in a Pat of the Head of State,2012-05-23T15:50:21+0000
https://www.nytimes.com/interactive/2022/05/13/us/covid-deaths-us-one-million.html,How America Lost One Million People,2022-05-14T01:53:15+0000
https://www.nytimes.com/2013/02/06/books/nelson-mandela-by-kadir-nelson-and-more.html,Black History Greats,2013-02-06T16:47:43+0000
https://www.nytimes.com/2022/07/20/arts/design/duverney-drawing-gallery-art-review.html,Oasa DuVerney’s Black Power Wave,2022-07-20T21:00:28+0000
https://www.nytimes.com/2015/08/16/fashion/mens-style/forget-retro-the-men-of-havana-embrace-the-reggaeton-look.html,Forget Retro. The Men of Havana Embrace the Reggaeton Look.,2015-08-14T09:00:43+0000
https://www.nytimes.com/2021/03/04/opinion/suess-books-race-bias.html,Six Seuss Books Bore a Bias,2021-03-04T00:38:49+0000
https://www.nytimes.com/2021/10/21/us/ashley-jones-poet-laureate-alabama.html,Alabama’s Next Poet Laureate Writes Searingly About Race,2021-10-21T09:00:22+0000
https://www.nytimes.com/2017/04/07/nyregion/new-york-city-wigmakers.html,Last of New York’s Master Wigmakers,2017-04-07T09:00:39+0000
https://www.nytimes.com/2017/10/06/books/ya-fantasy-diverse-akata-warrior.html,Nnedi Okorafor and the Fantasy Genre She Is Helping Redefine,2017-10-06T19:22:12+0000
https://well.blogs.nytimes.com/2011/03/21/a-decade-of-boosting-breast-size/,A Decade of Boosting Breast Size,2011-03-21T19:16:55+0000
https://www.nytimes.com/2022/02/08/books/review/white-lies-aj-baime.html,"Antagonist, Activist, Operator, Survivor",2022-02-08T10:00:04+0000
https://www.nytimes.com/2020/08/11/health/microaggression-medicine-doctors.html,"For Doctors of Color, Microaggressions Are All Too Familiar",2020-08-11T06:30:10+0000
https://www.nytimes.com/2021/08/24/business/media/ebony-magazine-return.html,Ebony Returns to Chronicle a New Moment,2021-08-24T09:00:16+0000
https://www.nytimes.com/2014/01/30/sports/football/a-pioneering-black-quarterbacks-lasting-legacy.html,A Pioneering Black Quarterback’s Lasting Legacy ,2014-01-30T01:35:48+0000
https://www.nytimes.com/2015/06/22/opinion/charles-blow-in-charleston-a-millennial-race-terrorist.html,"In Charleston, a Millennial Race Terrorist",2015-06-22T00:41:48+0000
https://www.nytimes.com/2015/05/28/us/politics/hillary-clinton-in-south-carolina-reminds-black-women-of-her-support-for-obama.html,"Hillary Clinton, in South Carolina, Reminds Black Women of Her Support for Obama",2015-05-28T00:26:33+0000
https://www.nytimes.com/2014/10/02/opinion/living-with-the-terror-of-ebola.html,Living With the Terror of Ebola,2014-10-01T22:39:27+0000
https://www.nytimes.com/2019/05/10/learning/where-would-you-visit-to-find-out-more-about-your-familys-past.html,Where Would You Visit To Find Out More About Your Family’s Past?,2019-05-10T09:00:02+0000
https://www.nytimes.com/2017/04/01/opinion/sunday/finding-growth-at-my-historically-black-college.html,Why I Chose a Historically Black College,2017-04-01T18:30:22+0000
https://www.nytimes.com/2012/07/13/business/wet-seal-accused-of-racial-bias-by-3-ex-managers.html,Lawsuit Claims Race Bias at Wet Seal Retail Chain,2012-07-12T18:05:18+0000
https://www.nytimes.com/2019/09/06/arts/music/crushers-club-jay-z-dreadlocks.html,A Gift From the N.F.L. Ignites a Firestorm Over Dreadlocks,2019-09-06T22:44:19+0000
https://www.nytimes.com/2016/12/01/arts/ousmane-sow-dead-senegal-sculptor.html,"Ousmane Sow, Sculptor of Larger-Than-Life Figures, Dies at 81",2016-12-02T01:28:34+0000
https://www.nytimes.com/2020/10/27/books/review-kidnapping-club-jonathan-daniel-wells.html,When a Kidnapping Ring Targeted New York’s Black Children,2020-10-27T09:00:02+0000
https://www.nytimes.com/2013/05/08/us/willie-j-manning-granted-stay-of-execution.html,"With Hours to Go, Execution Is Postponed",2013-05-07T23:34:44+0000
https://www.nytimes.com/2016/04/28/fashion/beyonces-lemonade-stylist-on-new-orleans-as-fashion-inspiration-that-yeezy-two-piece-and-more.html,"Beyoncé’s Stylist on Her Boss’s Inspiration Boards, Trust and That Yeezy Two-Piece",2016-04-26T23:04:05+0000
https://www.nytimes.com/2021/05/11/arts/design/deitch-black-artists-los-angeles.html,A Gallery Featuring Only Artists of Color Feels Like Change,2021-05-11T16:54:09+0000
https://www.nytimes.com/2017/07/30/insider/a-pentagon-correspondent-keeps-sight-of-the-person-inside-the-uniform-transgender.html,A Pentagon Correspondent Keeps Sight of the Person Inside the Uniform,2017-07-30T09:00:14+0000
https://www.nytimes.com/2020/02/21/business/jayne-matthews-edo-hair.html,"The Work Diary of a Hairdresser So Coveted, She Travels by Private Jet",2020-02-21T10:00:11+0000
https://www.nytimes.com/2013/07/18/garden/weeding-out-the-riffraff.html,Weeding Out the Riffraff,2013-07-17T23:00:44+0000
https://www.nytimes.com/2019/07/09/us/chicago-defender-newspaper.html,"The Chicago Defender, Legendary Black Newspaper, Prints Last Copy",2019-07-09T09:00:14+0000
https://www.nytimes.com/2023/10/16/us/scholastic-book-fair-diversity-censorship.html,"For Book Fairs, Scholastic Will Separate Titles That Deal With Race and Gender",2023-10-16T20:12:50+0000
https://www.nytimes.com/2018/06/30/opinion/is-neymar-black-brazil-and-the-painful-relativity-of-race.html,Is Neymar Black? Brazil and the Painful Relativity of Race,2018-06-30T17:59:58+0000
https://www.nytimes.com/2021/10/25/us/utah-school-racial-harassment-doj.html,"Utah School District Ignored Racial Harassment for Years, Report Says",2021-10-25T16:24:53+0000
https://www.nytimes.com/2021/06/03/arts/dance/kyle-marshall-stellar.html,"A Choreographer Finds His Way, Getting Lost in the Stars",2021-06-03T14:00:08+0000
https://www.nytimes.com/2021/10/18/us/shantel-arnold-jefferson-parish.html,Video Shows Louisiana Sheriff’s Deputy Slamming Black Woman to the Ground,2021-10-18T18:16:32+0000
https://www.nytimes.com/2019/04/10/obituaries/rose-morgan-overlooked.html,"Overlooked No More: Rose Morgan, a Pioneer in Hairdressing and Harlem",2019-04-10T20:05:55+0000
https://www.nytimes.com/2022/08/19/theater/black-outsiders-london-plays.html,"In Two London Plays, Being Black Means Looking From the Outside In",2022-08-19T15:01:18+0000
https://www.nytimes.com/2021/10/05/books/review/chibundu-onuzo-sankofa.html,"My Dad, the Dictator",2021-10-05T09:00:04+0000
https://www.nytimes.com/2020/10/25/podcasts/the-daily/my-mustache-my-self.html,"The Sunday Read: ‘My Mustache, My Self’",2020-10-25T13:00:07+0000
https://www.nytimes.com/2010/06/18/nyregion/18nycup.html,"Making Their Own National Noise, but Losing Anyway",2010-06-18T00:32:54+0000
https://www.nytimes.com/2023/09/13/arts/television/poland-blackface-beyonce-kendrick-lamar.html,Singing Competition Again Comes Under Fire After Use of Blackface,2023-09-13T16:27:46+0000
https://www.nytimes.com/2014/05/16/books/nicholas-wades-a-troublesome-inheritance.html,Charging Into the Minefield of Genes and Racial Difference,2014-05-15T22:00:10+0000
https://www.nytimes.com/2017/01/31/sports/westminster-dog-show-new-breeds.html,Westminster Dog Show 2017: Meet the New Breeds,2017-01-31T17:18:54+0000
https://www.nytimes.com/2021/03/04/obituaries/erica-faye-watson-dead-coronavirus.html,"Erica Faye Watson, Comedic ‘Hidden Gem of Chicago,’ Dies at 48",2021-03-04T23:23:11+0000
https://www.nytimes.com/2020/11/30/books/review/black-futures-kimberly-drew-jenna-wortham.html,"A Peek at the Variety, Wonder and Trauma of Black Life, Then and Now",2020-11-30T10:00:05+0000
https://carpetbagger.blogs.nytimes.com/2013/12/18/clothes-and-character-mandela/,Clothes and Character: ‘Mandela’,2013-12-18T17:00:34+0000
https://www.nytimes.com/2017/12/08/opinion/sunday/should-medicine-discard-race.html,What Doctors Should Ignore,2017-12-08T10:45:29+0000
https://www.nytimes.com/2014/09/12/arts/design/what-ernest-coles-hidden-camera-revealed.html,Capturing Apartheid’s Daily Indignity,2014-09-11T19:41:23+0000
https://www.nytimes.com/2022/05/19/briefing/russia-ukraine-africa-hunger.html,Your Friday Briefing: Russia Seeks More Control Over Occupied Ukraine,2022-05-19T21:02:56+0000
https://www.nytimes.com/2022/05/19/briefing/russia-ukraine-africa-hunger.html,Your Friday Briefing: Russia Seeks More Control Over Occupied Ukraine,2022-05-19T21:02:56+0000
https://www.nytimes.com/2023/08/04/world/europe/novorossiysk-attack-russia-black-sea.html,"What to Know About Novorossiysk, the Russian Port Attacked by Ukraine",2023-08-04T13:33:02+0000
https://www.nytimes.com/2020/07/08/us/bloomington-indiana-vauhxx-booker.html,F.B.I. to Investigate Case of Black Man Pinned by White Man in Indiana,2020-07-08T16:43:02+0000
https://www.nytimes.com/2021/09/17/arts/music/mickey-guyton-remember-her-name.html,Nashville Didn’t Make Room for Mickey Guyton. So She Made Her Own.,2021-09-17T09:00:20+0000
https://www.nytimes.com/2022/09/09/sports/horse-racing/real-players-backstretch-horse-racing.html,"Two Barbers, a YouTube Channel and the Truth About Race at the Racetrack",2022-09-09T09:00:20+0000
https://www.nytimes.com/2012/04/04/arts/design/elizabeth-catlett-sculptor-with-eye-on-social-issues-dies-at-96.html,"Elizabeth Catlett, Sculptor With Eye on Social Issues, Is Dead at 96",2012-04-04T00:13:25+0000
https://www.nytimes.com/2016/04/21/books/jackie-carter-who-pushed-for-racial-diversity-in-childrens-books-dies-at-62.html,"Jackie Carter, Who Pushed for Racial Diversity in Children’s Books, Dies at 62",2016-04-21T00:35:54+0000
https://www.nytimes.com/2021/11/17/arts/design/metropolitan-museum-afrofuturist-seneca.html,Afrofuturist Room at the Met Redresses a Racial Trauma,2021-11-17T23:06:25+0000
https://bucks.blogs.nytimes.com/2011/06/09/thursday-reading-what-to-do-when-your-therapist-yawns/,Thursday Reading: What to Do When Your Therapist Yawns,2011-06-09T13:12:59+0000
https://www.nytimes.com/2013/08/29/sports/tennis/the-williams-sisters-always-had-the-ability-to-inspire.html,The Influence of Remaking the Racial Composition of a Sport,2013-08-29T01:25:28+0000
https://lens.blogs.nytimes.com/2013/09/13/reimagining-a-tragedy-50-years-later/,"Reimagining a Tragedy, 50 Years Later",2013-09-13T09:00:12+0000
https://www.nytimes.com/2014/08/09/us/judge-in-north-carolina-upholds-2013-voting-law.html,Judge Backs New Limits on North Carolina Voting,2014-08-09T01:47:13+0000
https://www.nytimes.com/2019/06/20/style/world-cup-players-say-muscles-and-makeup-mix-just-fine-thanks.html,"World Cup Players Say Muscles and Makeup Mix Just Fine, Thanks",2019-06-20T09:00:11+0000
https://www.nytimes.com/2020/10/15/business/beauty-store-race-protests.html,A Korean Store Owner. A Black Employee. A Tense Neighborhood.,2020-10-15T09:00:37+0000
https://www.nytimes.com/2018/05/02/arts/television/dear-white-people-creator-doubles-down-on-identity-politics.html,Why the Creator of ‘Dear White People’ Is Doubling Down on Identity Politics,2018-05-02T23:45:08+0000
https://www.nytimes.com/2018/01/11/style/hoop-earrings-identity.html,"Why I Can’t Quit You, Hoops",2018-01-11T20:08:10+0000
https://www.nytimes.com/2020/04/05/opinion/coronavirus-social-distancing.html,Social Distancing Is a Privilege,2020-04-05T23:28:07+0000
https://www.nytimes.com/2015/01/20/arts/mille-soleils-a-portrait-of-senegal-by-mati-diop.html,"Stuck, but Trying to Leave",2015-01-19T22:56:52+0000
https://www.nytimes.com/2020/08/30/health/skin-diseases-black-hispanic.html,Dermatology Has a Problem With Skin Color,2020-08-30T09:00:26+0000
https://www.nytimes.com/2021/07/23/sports/olympics/olympics-naomi-osaka-simone-biles.html,"The Olympics Rely On, but Don’t Support, Black Girl Magic",2021-07-23T04:01:09+0000
https://www.nytimes.com/2011/11/21/world/africa/ethiopian-troops-enter-somalia-witnesses-say.html,"Ethiopian Troops Said to Enter Somalia, Opening New Front Against Militants",2011-11-20T23:21:21+0000
https://www.nytimes.com/2021/06/15/nyregion/in-the-manhattan-da-race-arguing-for-a-fresh-point-of-view.html,"In the Manhattan D.A. Race, Arguing for a Fresh Point of View",2021-06-15T09:17:08+0000
https://www.nytimes.com/2011/06/11/us/11beliefs.html,"At Picnic for Black Mormons, No Sign of Church’s Biased Past",2011-06-11T01:50:34+0000
https://www.nytimes.com/2010/07/13/world/africa/13policy.html,"After Attacks in Uganda, Worry Grows Over Group",2010-07-13T01:35:56+0000
https://www.nytimes.com/2010/01/23/arts/television/23shore.html,Discussing That Word That Prompts Either a Fist Pump or a Scowl,2010-01-23T00:01:06+0000
